"","id","section_id","name"
"341",9067849642391,9837856083223,"Info on Portland YouthBuilders"
"342",9067640232215,8034898844439,"Info on Prescription Drug Assistance"
"343",9067386649623,17892221868951,"Info on Prisons (State and Federal correctional intuitions list)"
"344",9066400280727,9812921016983,"Info on Reach Community Development"
"345",9048720495511,9813091555863,"Info on Russian Oregon Social Services"
"346",9048615244695,9838622828823,"CLOSED - Safety Net of Oregon"
"347",9048112880279,4403576691223,"Info on Sellwood Community Center"
"348",9046926568087,9812921016983,"Info on Oregon Shopping Malls"
"349",9046510966167,9812921016983,"Info on Small Business Development Center (SBDC)"
"350",9045837787415,17882402900759,"Info on State of Oregon Building Codes Division (BCD)"
"351",9044507752983,17888344324503,"Info on State Marine Board (OSMB)"
"352",9043988390423,17888386519703,"Info on State Parks and Recreation Department"
"353",9043682603671,17888423136151,"Info on State Real Estate Agency"
"354",9043507760663,8034934627351,"Info on Stevens - Ness Law Publishing Co"
"355",9043262382999,17972627899799,"Info on STOP Adult Drug Court/Treatment Courts"
"356",9017619628183,17892620187159,"Info on Surplus Property Program - State of Oregon"
"357",9017223186583,9838622828823,"CLOSED - The Center for Family and Adolescent Research (CFAR)"
"358",9015486662551,8034959890199,"Info on The Oregon Garden"
"359",9015158351511,9378710071447,"Info on The Rebuilding Center"
"360",9013914886295,9837856083223,"Info on Troubled Youth Teen Crisis Hotline"
"361",9013579366935,7893301858071,"Info on United States Patent and Trademark Office (USPTO)"
"362",9013371031959,8034898844439,"Info on Urgent Care Clinics"
"363",9013233395479,7893301858071,"Info on US Bureau of Land Management (BLM)"
"364",9012465752343,7893301858071,"Info on US Copyright Office"
"365",9012261577239,7893301858071,"List of Veteran's Services/Cemeteries (US Department of Veterans Affairs)"
"366",8990959719831,4403576234903,"Info on US Forest Service - Pacific Northwest Region"
"367",8924820110615,4403569097879,"Report a Sinkhole - Portland"
"368",8906640347927,8034898844439,"Info on CareOregon Dental Office"
"369",8906093715223,9378427503639,"Info on Bus Transportation (Bus Depot CLOSED 2020)"
"370",8905912594327,9837542049559,"Info on Brentwood Darlington Community Center"
"371",8905698288023,9837856083223,"Info on Boys and Girls Club"
"372",8904579232407,8034959890199,"Info on Blues Festival"
"373",8904430051479,9837856083223,"Info on Big Brothers, Big Sisters (BBBS)"
"374",8904319873687,8034898844439,"Info on Arthritis Foundation (Great West Region)"
"375",8903227480215,8034898844439,"Info on American Red Cross"
"376",8902989839639,8034934627351,"Info on ACLU (American Civil Liberties Union)"
"377",8902830764823,9837856083223,"Info on American Association of Retired Persons"
"378",8902439584919,9813030927127,"Info on Advantis Credit Union"
"379",8901551880087,9838622828823,"CLOSED 3/25/21 - Portland Children's Museum"
"380",8901203063703,4403568417559,"CLOSED - Portland Multnomah Progress Board"
"381",8879239349655,9817372204055,"Info on Portland State University"
"382",8874596179991,8034933431191,"Info on Street Roots"
"383",8874174173463,9812921016983,"Info on PMMI (Portland Mall Management, Inc.)"
"384",8852321132567,9378427503639,"Info on Friends of the Green Loop"
"385",8851547358231,13087329420567,"CSR Protocol: Threat Call"
"386",8850618851223,17861234474647,"Info on State Legislature"
"387",8850393639959,9817400190103,"Info on Portland International Airport"
"388",8850058911511,4403576241943,"Info on Zoo Lights"
"389",8848790343831,8034898844439,"Info on Portland Community College Dental Clinic"
"390",8844814875799,9817372204055,"Info on OSU Extension Service"
"391",8844557200407,8034959890199,"Info on OMSI (Oregon Museum of Science and Industry)"
"392",8826802802071,4403576689559,"CLOSED - Interstate Shop/Garage"
"393",8826600842263,17976803738903,"Info on Court Supplies"
"394",8826317085463,9813091555863,"Info on Urban League of Portland"
"395",8822915981079,17976803738903,"Info on Courthouse Mailroom"
"396",8770275818647,8034934627351,"Info on Multnomah Law Library"
"397",8768239238423,4403576231063,"Info on Court Arbitration"
"398",8767511947799,9838622828823,"CLOSED - Elders in Action"
"399",8767178425367,4403576687255,"Info on City Employee Assistance Program - CityStrong GuidanceResources"
"400",8766594289815,8034959890199,"Info on Interstate Firehouse Cultural Center (IFCC)"
"401",8747615582871,9812922295831,"Info on PGE Public Safety Power Shut-Off (PSPS)"
"402",8744225479959,9812921016983,"Info on African American Chamber of Commerce (AACC)"
"403",8742782029975,17888531111063,"Info on Military Family Support Resources"
"404",8742480358423,17861363964567,"Info on State of Oregon Department of Education"
"405",8742025859223,17888602504343,"Info on Oregon Board of Dentistry"
"406",8741939874967,7893301858071,"Info on Oregon Job Corps"
"407",8741623088919,6609414555287,"Info on East Metro Mediation"
"408",8741133943959,9813091555863,"Info on IRCO (Immigration & Refugee Community Organization) including Rental Assistance"
"409",8740791853079,8034898844439,"Info on Asian Health and Services Center"
"410",8740512192791,9813091555863,"Info on Asian Family Center (IRCO)"
"411",8717321593879,15677148281111,"CLOSED - Change Center (formerly the Londer Learning Center (LLC) )"
"412",8714333674263,8034959890199,"Info on Portland Art Museum (PAM)"
"413",8691685360151,9812922295831,"Info on Oregon Relay Service"
"414",8689007434647,8034959890199,"Info on Lan Su Chinese Gardens"
"415",8687973026839,17888945633687,"Info on Oregon Public Employees Retirement System"
"416",8611623908887,9837856083223,"Info on Jewish Family and Child Service (JFCS)"
"417",8565490125719,9838523960599,"Info on Multnomah Soil & Water Conservation District"
"418",8565329475607,9813030927127,"Info on Point West Credit Union"
"419",8556636041367,17539540007959,"Info on the River Patrol Unit - Multnomah County"
"420",8537735319447,9837856083223,"Info on IRCO Senior Center"
"421",8536431535639,9838201462551,"Info on County Community Involvement Committee (CIC)"
"422",8536461931799,9838201462551,"Info on Office of Community Involvement (OCI)"
"423",8534475992471,9837856083223,"Info on Neighborhood House Senior Programs"
"424",8534104587031,9837856083223,"Info on Friendly House Senior Programs"
"425",8533660750103,9837856083223,"Info on Hollywood Senior Center"
"426",8533423358487,9838622828823,"CLOSED -  North Senior Center - Impact Northwest"
"427",8509683586967,8034717097495,"Info on Bird Alliance of Oregon (formerly Audubon Society of Portland)"
"428",8508244457495,17888980620439,"Info on Oregon Commission for the Blind (OCB)"
"429",8502774723607,8035491930519,"Info on TriMet LIFT Program"
"430",8456510943127,8034934627351,"Info on Oregon State Bar"
"431",8456396033431,9378710071447,"Info on Portland Housing Center"
"432",8455997037847,9812921016983,"Info on Better Business Bureau of Alaska, Oregon, and Western Washington (BBB)"
"433",8448242397975,4403568425751,"Info on Department of County Assets (Administration)"
"434",8429716212631,4403576232599,"Former Commissioner Eudaly"
"435",8428532248471,17891569733783,"Info on State of Oregon Certification Office for Business Inclusion and Diversity - Minority and Women Business Enterprise Certification"
"436",8424830067351,4403569079575,"Info on the 2045 City Transportation System Plan"
"437",8403535553303,4403569048343,"Info on Gas/Fixing Our Streets Tax"
"438",8398270107287,8034933431191,"Info on Rose Haven Services for Women"
"439",8379444862231,4403576690455,"Info on Multnomah County Harm Reduction Clinic"
"440",8376999414807,8034260023703,"Info on METRO (Metropolitan Regional Government)"
"441",8374274146711,7222165929239,"Info on Portland Committee on Community-Engaged Policing (PCCEP)"
"442",8348598485399,8379086764439,"Info on Enhanced Service Districts (ESD)"
"443",8345475642007,11794086860567,"Apply for a Utility License"
"444",8344100280087,7222165929239,"Info on Party on, Portland (POP)"
"445",8300652521239,11794086860567,"Info on 3G Dissolution"
"446",8298518297495,4403568448663,"Info on Multnomah Education Service District (MESD)"
"447",8298202671255,4403576690455,"Info on Community Immunization Program"
"448",8298150671127,17539488352023,"CLOSED - Troutdale Correctional Facility"
"449",8298066446743,17539488352023,"CLOSED - Work Release Center"
"450",8298017026967,4403576710167,"CLOSED - Health Information and Referral, Multnomah County"
"451",8297921606679,8034898844439,"CLOSED - Regional Drug Initiative"
"452",8295692255511,4403576720663,"Info on Lloyd Event District, Parking"
"453",8294997984023,4403576720663,"Apply for a SmartPark Reduced Rate Swing Shift Permit"
"454",8244845711383,4403569097879,"Info on Flooding and Sandbags"
"455",8242588167191,4403576246551,"ZenDesk Triage of an ADA Request/Discrimination Report"
"456",8223504499095,4403569101463,"Report a Violation to BDS"
"457",8222923100055,4403569101463,"Report Vegetation Blocking Traffic Signals/Signs, Visibility at Intersections"
"458",8218891579927,10761782124055,"Info on City Spectator Facilities Program"
"459",8193491384343,4403569068695,"Info on City Hearings Office/Code Hearings"
"460",8192576590999,10762297747863,"Info on CSZ Face Masks"
"461",8173997166103,4403569092503,"Submit a Non-Street Parking Penalty Notice Complaint"
"462",8173816622487,4403569092503,"Info on Lien Reduction Review Program"
"463",8143040029847,7469149334039,"Contacts for State Information and Referral"
"464",8113605762711,17908979667351,"Info on the Oregon Board of Naturopathic Medicine"
"465",8112793324951,17911231900823,"Info on Oregon Radon Awareness Program"
"466",8111153368343,4403569078167,"Info on Gateway Green Off-Road Cycling Park"
"467",8110570134039,4403569079959,"Info on Outdoor Tennis Courts and Emerging Recreation Strategy"
"468",8110140915607,11497965760663,"Info on Portland Parks Board"
"469",8083689732503,4403568447383,"Info on Basic Earthquake Emergency Communication Nodes (BEECN)"
"470",8083220819991,4403576225815,"Info on Public Alerts Notification System"
"471",8082745769367,11578014724503,"Info on N/NE Neighborhood Housing Strategy"
"472",8056846334231,4403569060119,"Share an Anonymous Tip (Crime Stoppers)"
"473",8055840716567,11497893450263,"Info on ParkScan"
"474",8055334817047,4403569111831,"Info on Willamette Park"
"475",8033407852311,9944266268695,"Request a Community Garden Plot"
"476",8033150877591,9944266268695,"Info on Produce for People Program"
"477",8031105728151,4403569063191,"Info on Gateway Discovery Park"
"478",7958034789527,5549583819927,"Former Commissioner Amanda Fritz"
"479",7903248601751,17891131839511,"Info on State Indigent Burial/Cremation Program"
"480",7901799009431,17889050079639,"Info on State Health Licensing Office"
"481",7901160766743,17889206017431,"Info on State Public Utility Commission"
"482",7873401111319,11574364082839,"Submit a Customer Issue/Complaint to Portland's Water Bureau"
"483",7869249599511,17976803738903,"Info on Presiding Court"
"484",7865657687319,17976803738903,"Info on Court Calendaring - Multnomah County"
"485",7815216920471,4403569090455,"File a Supplemental Police Report"
"486",7814400107927,10761834248471,"Portland.gov Events Calendar"
"487",7811267603095,17893126901911,"Report a Violation of the Indoor Clean Air Act"
"488",7767731567383,7893301858071,"Federal Information and Referral - Contact List "
"489",7764997927319,4403568423447,"Report County Employee Suspected Fraud, Waste, and Abuse of Position (Good Government Hotline)"
"490",7743570515735,4403576690455,"Info on Multnomah County Syringe/Needle Exchange Program"
"491",7741430848407,17912272189719,"Info on Oregon Home Care Commission"
"492",7704667963031,9838228854551,"Info on Willamette Light Brigade"
"493",7635349441687,4403569068183,"Info on Construction and Demolition Debris"
"494",7634639706647,11793982412567,"Info on Cooling Portland: A Portland Clean Energy Fund Climate Resilience Program (Air Conditioner)"
"495",7633410015895,11793885530391,"Info on City of Portland Comprehensive Planning - BPS"
"496",7627698545047,8034933431191,"Info on Temporary Homeless Shelters / Severe Weather Centers"
"497",7626779847959,11577306491415,"Info on Prosper Portland’s Inclusive Business Resource Network"
"498",7602776022935,14449886770839,"Info on Green Streets Program"
"499",7601571450647,4403569090839,"Info on BDS Record Resources"
"500",7574939299991,4403569079575,"Info on ADU SDC Waiver Program"
"501",7549317226775,8034959890199,"Info on the Rose Festival and Rose Festival Foundation"
"502",7548805829399,9378427503639,"Info on Ride Connection"
"503",7500017854231,8034959890199,"Info on Portland Farmer's Market"
"504",7499717698967,8034959890199,"Info on Pioneer Courthouse Square Inc"
"505",7498830364951,8034717097495,"Info on Oregon Humane Society (OHS)"
"506",7498825464343,8034717097495,"Info on Feral Cat Coalition"
"507",7498822510743,15192330325655,"Report Animal Crimes (Animal Cruelty)"
"508",7498304864023,8034959890199,"Info on Oregon Historical Society"
"509",7496741491607,4403576239639,"Info on Inquiries from Visiting Delegations"
"510",7479091229591,9813030927127,"Info on First-Time Buyer and Home Ownership Resources"
"511",7477056458135,9934615921047,"List of  Elected Government Officials"
"512",7475936964119,8034898844439,"Info on CPR Training"
"513",7469649523735,17864460521495,"Info on the State Department of Fish & Wildlife (ODFW)"
"514",7450032536983,8034933431191,"Info on Central City Concern (CCC)"
"515",7449412842903,8034898844439,"Info on CareOregon (Care Oregon)"
"516",7446307806103,4403569054231,"Sign up to Share Public Communications with City Council"
"517",7446227826071,4403569054231,"Sign Up to Share a Comment/Testimony with City Council"
"518",7407800025111,4403569077783,"File a Pollution Complaint with DEQ"
"519",7406566253719,4403569077783,"View Parking Citation Photos"
"520",7403082467735,4403569098391,"Info on Streetcar Track Access Permits"
"521",7402805266711,4403569098391,"Info on Willamette Shore Trolley"
"522",7384397029399,10127100999575,"Submit a Complaint or Commendation About Police"
"523",7327627658903,7325091366679,"Info on Public Trash Cans (Expansion)"
"524",7327230433431,7325091366679,"Info on Digital Divide Response - Tech Kit Expansion"
"525",7327051786775,7325091366679,"Info on NAYA Homeownership Assistance"
"526",7326698114839,7325091366679,"Info on African American Alliance for Homeownership"
"527",7325784641431,7325091366679,"Info on the Oregon Worker Relief Fund"
"528",7325543645207,9813030927127,"Info on Homeowner Foreclosure Prevention Programs"
"529",7304627212567,4403576720663,"Info on Disability Parking Survey (Jan, 2022)"
"530",7302037402263,4403576740887,"Report a Problem with a Public Trash Can"
"531",7300628445847,4403576256535,"Become a Master Recycler"
"532",7298870070167,4403569101463,"Report a Non-Urgent Traffic Safety Concern (823-SAFE)"
"533",7276414164503,8034959890199,"Get Ordained to Perform a Marriage Ceremony"
"534",7248732568343,4403576689559,"Submit a City Vehicle/Driver Complaint"
"535",7247510712343,17539533051031,"Apply for a Concealed Handgun License"
"536",7246340764567,10119858193175,"Info on City Charter Review Commission"
"537",7222470547735,7222165929239,"Info on Safer Summer PDX"
"538",7222323737751,7222165929239,"Info on FIT/COG, Focused Intervention Team Community Oversight Group"
"539",7222206839703,7222165929239,"Info on Community Safety Division - City of Portland"
"540",7172220340503,9934615921047,"Opt Out of Junk Mail"
"541",7146076628503,8034934627351,"Info on Oregon Law Center"
"542",7145730591511,8034934627351,"Info on St. Andrew Legal Clinic"
"543",7144131211159,8034934627351,"Info on Legal Aid Service of Oregon (Multnomah County)"
"544",7143762515351,8034934627351,"Info on Youth Rights & Justice (Attorneys at Law)"
"545",7143623778583,8034934627351,"Info on Portland Community College CLEAR Clinic"
"546",7143155085975,4403576706199,"Report a Spill in/or Contact the Columbia South Shore Groundwater Protection Program"
"547",7120712419863,11496831696279,"Info on Eviction Legal Defense Project"
"548",7120333612567,11496831696279,"Info on Rental Services Commission (RSC)"
"549",7120055695767,11496831696279,"Info on Mandatory Renter Relocation Assistance"
"550",7119565385495,11577811273239,"Info on the Fair Access in Renting Ordinance (FAIR)"
"551",7119069834775,11496831696279,"Info on Resolutions NW"
"552",7094782961431,4403569096087,"Report a Gas Leak (NW Natural)"
"553",7089771963799,8034933431191,"Info on Bybee Lakes Hope Center (BLHC)"
"554",7089610890519,8034933431191,"Info on Kenton's Women's Village"
"555",7089005440151,8034933431191,"Info on St. John's Village (Transitional Housing)"
"556",7068662194455,8034933431191,"Info on JOIN (Portland Homeless Services)"
"557",7067982041623,8034933431191,"Info on Transition Projects Inc."
"558",7067980232215,8034933431191,"Homeless Youth Service Agencies/Shelters - Contact List"
"559",7067979310359,8034933431191,"Homeless Service Agencies/Shelters/Outreach - Contact List"
"560",7062912994711,4403576685207,"Info on My Discovery Pass (Multnomah County Library)"
"561",7062003764503,4403576699671,"Info on the Additional Needs Registry"
"562",7061258812311,4403576699671,"Info on Independent Living Resources"
"563",7013402585367,9813091555863,"Info on Black Parent Initiative"
"564",6982544787479,15541272957079,"Request a Death Certificate (Within past 6 Months) - County Vital Records"
"565",6959339412631,4403576232215,"Info on Facial Recognition Technologies Ordinance"
"566",6936437758231,11793982412567,"Info on PCEF Mini Grants (Portland Clean Energy Community Benefits Fund)"
"567",6935525286167,4403569065111,"Report a Plugged Storm Drain"
"568",6934381767831,4403569091735,"Info on Gas Express Program"
"569",6934225829015,4403569091735,"Info on Field Issuance Remodel (FIR) Program"
"570",6929512365079,5772392705815,"Report a Pothole - Milwaukie"
"571",6929312842903,5772392705815,"Report a Pothole - Lake Oswego"
"572",6928986316055,5773356402711,"Report a Pothole - Gresham"
"573",6859470352919,5772532606743,"Report a Pothole - Beaverton"
"574",6857635719575,5772532606743,"Request Road Service - Washington County"
"575",6856741219351,5772392705815,"Report a Non-Hazardous Road Concern - Clackamas County"
"576",6856740586135,5772392705815,"Report a Hazardous Road Concern - Clackamas County"
"577",6852511016983,4403569096087,"Local Utility Companies - Contact List"
"578",6852268080023,7893301858071,"Info on the Federal Consumer Financial Protection Bureau"
"579",6851906650519,6452416002583,"Clackamas County Information/Services - Contact List"
"580",6851670887319,10639182199191,"Nearby Local Counties - Contact List"
"581",6800056765719,15751718956311,"Look up a Parole or Probation Officer (PPO)"
"582",6774975012631,11574305188631,"Request a Payment Arrangement for a Water, Sewer, Stormwater Bill"
"583",6771738248087,11577342661655,"Info on Oregon Homeownership Stabilization Initiative"
"584",6747680008215,4403569065111,"Report a Sewer Odor "
"585",6658205434647,4403576686743,"Info on Summer Free for All Program"
"586",6658204213783,4403576686743,"Info on Free Lunch + Play in Portland Parks"
"587",6652965263383,9378427503639,"Info on Free2Move, Carshare"
"588",6636050915095,15289442802327,"Info on Preschool for All Program"
"589",6634533365399,4403569092503,"Apply for a Temporary Business License"
"590",6629272847255,4403569092503,"Info on Multnomah County Business Income Tax Programs"
"591",6629151991959,4403569092503,"Pay Taxes Through Portland Revenue Online"
"592",6609896394391,5773356402711,"File a Police Report - City of Gresham"
"593",6609852192535,6609414555287,"Info on Gresham Police Department"
"594",6524788961303,11578492705943,"Request a Police Ride Along"
"595",6523598733591,8034898844439,"Info on Cascadia Behavioral Healthcare"
"596",6504504306071,8034898844439,"Info on Suicide Hotline"
"597",6504283902871,8034898844439,"Info on NorthStar Clubhouse"
"598",6503857026711,8034898844439,"Info on FolkTime"
"599",6503506917271,9934296161943,"Info on Maybelle Center for Community (Macdonald Residence)"
"600",6503047858839,8034898844439,"Info on Portland Street Medicine"
"601",6479416650007,8034934627351,"Info on Clean Slate and Legal Services Day/Expungement"
"602",6453294063511,7892889904791,"Apply for Energy and Water Assistance - Yamhill County"
"603",6452618787351,6452416002583,"Apply for Energy Assistance - Clackamas County"
"604",6452256224791,6451981368471,"Apply for Utility Assistance (Community Action) - Washington County"
"605",6451765702167,8034934627351,"Legal Assistance Resource List"
"606",6376473778711,17909859433239,"Order an Apostille, Statement of No Marriage on File"
"607",6376107775767,17909859433239,"Order Birth/Death Certificates, Records 6+ Months Old"
"608",6375097965463,17909859433239,"Order Marriage/Divorce Records (Statewide)"
"609",6352591563927,4403576258455,"Request a Criminal History Background Check"
"610",6350623435159,15540768871703,"Report a Dead Bird/Birds"
"611",6349150700695,4403576722199,"Info on East Portland PBOT Capital Construction Projects (2022-23)"
"612",6333094584087,15540768871703,"Report a Bee Swarm / Portland Urban Bee Keepers"
"613",6333107996823,11578953432983,"Info on Raising Bees/Beekeeping in Portland"
"614",6332498327703,15540810828823,"Info on Mold, Environmental Health"
"615",6332245685783,15540810828823,"Info on Wood Burning Restrictions"
"616",6332162819351,15540747273111,"File a Complaint About Wood Burning"
"617",6332001281431,15540810828823,"Apply for a Wood Burning Exemption"
"618",6331540431639,17889161377943,"Info on Oregon Department of Agriculture - Food Safety Division"
"619",6326613080471,5773356402711,"Report a Drug House or Drug Lab - Gresham"
"620",6326382859031,17911231900823,"Info on Clandestine Drug Lab Cleanup"
"621",6306724903319,4403576706967,"Info on Walking Tours"
"622",6305719387927,10127439561879,"Info on the Percent for Art Program"
"623",6305638868119,10127439561879,"Info on City Arts Program, Arts Grants and the Portland Monuments Project"
"624",6304239763479,7325091366679,"Info on American Rescue Plan - Investing in Portland - City"
"625",6303045042839,5773356402711,"Report Graffiti on Public & Private Property - Gresham"
"626",6276790345495,10127100999575,"Info on Street Service Coordination Center (SSCC)"
"627",6225107993495,11497781674903,"Info on ChipDrop"
"628",6224395070231,4403569048343,"Local Transportation Infrastructure Charges (LTIC)"
"629",6223706612503,4403569065111,"Info on Environmental Systems - PBOT Maintenance"
"630",6223542442775,14449945130903,"Info on Stormwater Drainage Issues"
"631",6221629074455,4403576720663,"Info on Driveway Clearance Painting Regulations"
"632",6221329696023,4403576720663,"Order Mailbox Clearance Signage"
"633",6202457426839,4403569097879,"Info on Landslides or Potential Landslides"
"634",6202126419991,4403576734103,"Report Curb, Corner, and ADA Curb Ramp Issues"
"635",6200803696791,14450499533975,"Info on Permits for Sewer Lateral Repairs and Connections in the Right of Way"
"636",6197790951191,17889161377943,"Report Lost or Found Livestock"
"637",6176996297367,7893301858071,"Info on Federal Aviation Administration (FAA)"
"638",6174379356567,17889161377943,"Report a Found Dead Rabbit"
"639",6152685654039,15200247397655,"Info on Poop Scoop Ordinance"
"640",6152570269847,15192312566807,"Info on Animal Licensing"
"641",6152215458583,15200230907287,"Info on Stray Cat Intake and Apartment Cat Team"
"642",6150766209175,17889083423255,"Info on the Veterinary Medical Examining Board"
"643",6147787037591,15200247397655,"Report a Lost Pet"
"644",6147397633303,15192312566807,"Info on Exotic Animals, Permits"
"645",6147253077527,15200230907287,"Info on Kitties for Hire Program"
"646",6146303308439,5773356402711,"File a Noise Complaint - City of Gresham"
"647",6145853938583,5772532606743,"File a Noise Complaint - Washington County"
"648",6120792488343,4403576734103,"Report a Broken Sidewalk"
"649",6071601493783,11497779519767,"Apply for a Tree Planting/Removal Permit"
"650",6071447538455,11497781674903,"Info on the Tree Inventory Project"
"651",6070572360471,11497781674903,"Info on Portland's Free Yard Trees Program"
"652",6068772450967,4403569094551,"Info on the Right of Way Enforcement Program"
"653",6068102153495,10638365607959,"Report Blockage or Obstruction on Private Property"
"654",6066761161623,4403576720663,"Apply for a Disabled User Parking Permit"
"655",6066503984279,4403576720663,"Apply for an Annual Parking Permit for a Business or Nonprofit"
"656",6049575927959,4403576720663,"Apply for a Public Parking Carpool Permit"
"657",6049410869783,4403576720663,"Apply for a Musician Loading Zone Permit"
"658",6045586107031,4403569048343,"Info on Pavement Moratorium"
"659",6044981394455,9941189837719,"Info on Contract Administration (PBOT)"
"660",6026288693911,4403569094551,"Info on PBOT Stewardship Program"
"661",6026282380951,4403569094551,"Info on Combined Publication Box Permits"
"662",6025936159767,4403569094551,"Apply for a Street Painting Permit"
"663",6024022104599,4403569101463,"Info on Portland Pathway Program (Urban Trails)"
"664",6023463915415,4403569101463,"Info on Play Streets Permits"
"665",6023292578199,4403569101463,"Info on Spaces to Places Permits"
"666",6023084139671,4403569101463,"Apply for a PARK(ing) Day Permit"
"667",6018951557911,9940924520727,"Info on Fast Stop 5-Minute Parking Zones "
"668",6018821620503,9940924520727,"Info on Traffic Intervention Strategies for Reducing Gun Violence/Crime "
"669",6018256039703,9940924520727,"Info on Slow Streets/Safe Streets Program"
"670",6018224363159,9940924520727,"Discontinued - Temporary Business Pickup/Drop-off Parking Space"
