"","id","section_id","name"
"1326",4405750275863,10638365607959,"Info on Home Occupation Permits - Running a Business Out of a Home"
"1327",4405750274455,4403569058455,"Contact BDS Customer Service"
"1328",4405743669143,10638365607959,"Info on Property Code Compliance Program - City of Portland"
"1329",4405743667351,10638641309847,"Info on Commercial Structural and Mechanical Inspections"
"1330",4405743665687,10638641309847,"Info on Commercial Plumbing Inspections"
"1331",4405743664279,10638641309847,"Info on Commercial Electrical Inspections"
"1332",4405743662615,10638427560983,"Info on Building Code Appeals"
"1333",4405743655575,4403568415127,"Multnomah County Chair: Jessica Vega Pederson"
"1334",4405743652119,17971156069527,"Info on State Attorney Generals Office/Oregon Department of Justice (DOJ)"
"1335",4405743650455,4403568414615,"Info on 211 Info (211info)"
"1336",19434830290327,11497840017047,"Guidelines for Tree Hazards"
"1337",16222439047831,4403568426775,"Kmart Fire Asbestos Response - DEQ - July 28, 2023 Update"
"1338",15920288843799,17861234474647,"State Rent Increase Caps (Senate Bill 611)"
"1339",12817607563671,13087310179223,"Vehicle Inspection Team (VIT) FAQ"
"1340",12421399644823,15200638502807,"Info on Multnomah County Penalty Waivers (Preschool for All Tax)"
"1341",11077351522839,4403576231063,"Request an Order of Assistance or Writ of Assistance / Property Retrieval"
"1342",10938698659863,4403576706967,"CSZ Badging Standard Operating Procedures"
"1343",10897085054871,4403568428183,"Info on Paid Leave Oregon"
"1344",10659212014103,15490062083223,"Info on Behavioral Health Resource Center"
"1345",10614132014231,4403576714007,"Info on City Water Lead Testing"
"1346",10549825810967,9937020154903,"Phone Workflow (Call Logging)"
"1347",10326162048279,17893249678999,"Sign up for Health Insurance (Healthcare.gov)"
"1348",10250465296535,15640970462615,"Look up County Staff/Employee Directory"
"1349",9996149487255,4403576238615,"Submit a Complaint to Portland Fire & Rescue"
"1350",8931053007127,15489881075351,"Info on Multnomah County Transit Service and Shuttles"
"1351",8901789669143,9838622828823,"CLOSED - DADS Against Discrimination "
"1352",7903537695383,4403576258455,"Info on Oregon Board of Medical Examiners"
"1353",7901161190295,17889206017431,"Submit a Complaint to the Oregon Public Utility Commission"
"1354",7810358613015,4403568434455,"Info on Public Environment Management Office (PEMO)"
"1355",7610012227095,17864460521495,"Info on Raccoons"
"1356",7011160379927,15192330325655,"Contact Emergency Animal Services (Multnomah County)"
"1357",6982001973143,17971027154711,"Report a Bias/Hate Incident (State of Oregon)"
"1358",6851277258135,9934538072087,"List of Info on All Oregon Cities"
"1359",6653714701591,4403569093783,"File an Auto Liability Claim with City Risk Management"
"1360",6523306049815,8034898844439,"Contact List for 24 Hour Crisis Hotlines"
"1361",6300371745943,4403569074327,"Info on Northeast Portland Tool Library (NEPTL)"
"1362",6280056363159,10638365607959,"Info on Cannabis Emergency Relief Fund"
"1363",6126488435607,10638365607959,"Apply for a Noise Variance"
"1364",6067484778775,11497779519767,"Report a Tree Code Violation"
"1365",6048355170839,4403569042199,"Info on Transportation Wallet"
"1366",5996838396695,17861350599191,"Info on Protective Sick Time Law"
"1367",5600366886551,4403576233623,"Request Public Records - Multnomah County"
"1368",5477244341911,13119341296663,"Fire/Medical - Public Safety Non-Emergency Response Line"
"1369",4917165366039,4403569077783,"Report Automobile Campsite (VIT)"
"1370",4405744588183,15191293135895,"Info on County Medical Examiner’s Office"
"1371",4405744563607,4403576257303,"Info on Secretary of State - Corporation Division"
"1372",4405744517015,11578492705943,"Info on Portland Police Bureau Neighborhood Response Teams"
"1373",4405744272407,4403569063959,"Verify Employment of a Current or Former City Employee"
"1374",4405750575511,10638365607959,"Info on City Liquor License Notification Program"
"1375",4405744191767,4403576245655,"Info on Department of Motor Vehicles Services (DMV)"
"1376",4405744077079,4403576694807,"Info on Multnomah County Dental Clinic/Access Program"
"1377",4405744066199,4403576690455,"Info on Multnomah County Communicable Disease Services"
"1378",4405750497943,8035220542359,"Info on East County Courthouse"
"1379",4405744033687,4403576237719,"Apply for a Restraining Order"
"1380",4405744027927,17970370560791,"Info on Juvenile Unit (District Attorney)"
"1381",4405743999255,15200623909783,"Apply for a Marriage License - Multnomah County"
"1382",4405743977239,15172640214551,"Multnomah County Developmental Disabilities Program (Intake and Eligibility)"
"1383",4405743960471,15288281829655,"Info on Multnomah County Veterans’ Services"
"1384",4405743944599,15288276156055,"Info on East Aging, Disability & Veterans Services Office"
"1385",4405750437015,15172643163287,"Info on Energy Bill Payment Assistance"
"1386",4405743936663,15172238000535,"Info on County Telecommunications"
"1387",4405743927831,15172148156311,"Info on County Mail Room"
"1388",4405743926167,9838447007127,"Info on Property Lines"
"1389",4405750429079,9838504456855,"Info on County Transportation Bike and Pedestrian Planning"
"1390",4405743916823,9838290031767,"Info on County Transportation Engineering and Operations"
"1391",4405743903767,15173422379927,"Contact Dept of Community Justice Public Information Office (PIO)"
"1392",4405750424727,15173468757015,"Info on Juvenile Services Division"
"1393",4405743892503,15751718956311,"Info on Multnomah County Probation and Parole District Field Offices & Programs"
"1394",4405743876247,15676741596951,"Info on Juvenile Custody Services"
"1395",4405743866647,15676854158103,"Info on Juvenile Delinquency Intervention & Prevention"
"1396",4405750405911,4403576234007,"Info on Victims Impact Panel"
"1397",4405743840151,17915793913495,"Info on Court Collections"
"1398",4405750272151,4403568415127,"County Commissioner District 1: Sharon Meieran"
"1399",18779715472407,11497840017047,"Tree Reports: ROW (A7)"
"1400",15701831872023,17861234474647,"Info on Oregon’s Self-Serve Gas Law"
"1401",14402790912535,17882402900759,"Info on Tri-County Service Center (Salem)"
"1402",12929521258007,9838290031767,"Report Hazardous Road Conditions - Multnomah County"
"1403",12903369405975,9838504456855,"Info on Multnomah County Transportation Road Projects"
"1404",11732413606807,13119341296663,"Report a Stolen Vehicle"
"1405",11569117230359,9838288170775,"Info on Code Compliance Program - Multnomah County"
"1406",11336925493527,4403576246551,"ADA/Disability Resources for 311 Staff"
"1407",11275893696279,4403569042199,"CSZ  PBOT Vision Zero Yard Signs"
"1408",10767698692759,4403576706967,"CSZ Visitor Guest Pass"
"1409",9995771133335,17893249678999,"Info on Oregon Veteran Dental Plan and COFA Dental Program"
"1410",9948559898263,9937020154903,"Email Workflow (Linking Articles)"
"1411",9537389678231,11547309484695,"Info on Water Bureau Hydroparks"
"1412",9506974289815,17915793913495,"Pay a Multnomah County Restitution Fee"
"1413",9381747391511,4403576258455,"Look up a Sex Offender"
"1414",9224752477847,4403576702487,"CLOSED -  Children’s Assessment Service"
"1415",9096431209751,15200638502807,"Info on Manufactured Home Tax Exemption"
"1416",8901850816791,9838622828823,"CLOSED - Rosemont School Inc."
"1417",8454798444055,4403576690455,"Regional Health and Human Services Contact Center - COVID General Questions/Hotline"
"1418",8381323213079,4403576704151,"Info on Community Health Access and Treat Program (CHAT) / High Utilizers Program"
"1419",8142729816087,4403568426775,"Info on Vehicle Emissions Inspections"
"1420",7901435639703,17889206017431,"Info on the Oregon Telephone Assistance Program (OTAP)"
"1421",7607078449687,17864460521495,"Info on Sauvie Island Wildlife Area, Beaches"
"1422",7275958449047,15200623909783,"Request a Certified Copy of a Marriage License"
"1423",7274240862615,4403576257303,"Info on Secretary of State - Nonprofit Organizations"
"1424",6828333513495,15288281829655,"Info on Senior Health Insurance Benefits (SHIBA)"
"1425",6769937094679,15172643163287,"Info on Oregon Emergency Rental Assistance Program"
"1426",6653362098455,4403569093783,"File a General Liability Claim with City Risk Management"
"1427",6604141628055,4403576237719,"Apply for a Stalking Order"
"1428",6504850781591,8034898844439,"Info on National Alliance for Mentally Ill (NAMI) - Multnomah County"
"1429",6503106204055,15490062083223,"Info on Project Respond Mobile Crisis Team"
"1430",6426154933783,4403576245655,"Info on Oregon Real ID"
"1431",6302069599383,11496119494935,"Info on Graffiti Removal Kits and Free Metro Paint"
"1432",6300832139159,4403576718743,"Info on North Portland Tool Library (NPTL)"
"1433",6199213039255,17865416297495,"Info on Oregon Liquor Control Commission (OLCC)"
"1434",6148567860887,15192330325655,"File an Animal Nuisance Complaint"
"1435",6127014217751,10638365607959,"File a Noise Complaint - Portland"
"1436",4943757440535,4403576713623,"Info on the Impact Reduction Program (IRP)"
"1437",4405744523031,4403569075095,"Info on North Precinct Neighborhood Response Team Officers"
"1438",4405744274839,4403569063959,"Info on City Employee Relations and HR Business Partners"
"1439",4405750515991,15191293135895,"Info on County Emergency Medical Services Administration (MCEMS)"
"1440",4405750513175,4403576694807,"Info on Billi Odegaard Downtown Dental Clinic"
"1441",4405744030871,17912173512855,"Info on Department of Early Learning and Care (DELC)"
"1442",4405744026647,17970398188439,"Info on Child Support Enforcement Division (SED, District Attorney)"
"1443",4405744004247,15640951422359,"Verify County Payroll and/or Employment"
"1444",4405743984151,4403576701591,"Info on The Gateway Center for Domestic Violence Services"
"1445",4405743980439,15172640214551,"Info on Abuse Investigations/Protective Services (Developmental Disabilities)"
"1446",4405750439575,15288276156055,"Info on Mid-County Aging, Disability & Veterans Services Office"
"1447",4405743935383,15172238000535,"Info on County SAP Support"
"1448",4405750433047,15172148156311,"Info on County Distribution Services"
"1449",4405750426007,15751718956311,"Info on Supervision/Probation Fees"
"1450",4405743886743,15173422379927,"Info on Assessment and Referral Center (ARC)"
"1451",4405750412311,15676854158103,"Info on Juvenile Probation"
"1452",4405743868311,15676741596951,"Info on Gender Specific Supervision Services for Young Women"
"1453",4405743859223,4403576234007,"Diversion - DUII - Contact List (driving under the influence)"
"1454",4405750400535,8035220542359,"Info on Court Appointed Attorneys"
"1455",4405743849367,4403576233623,"CLOSED - Multnomah County Personal Income Tax"
"1456",4405743654295,4403568415127,"County Commissioner District 2: Jesse Beason"
"1457",4405750270999,17971094054167,"Info on Consumer Hotline - Attorney General"
"1458",19376905692183,11497840017047,"Tree Reports: Specific Addresses (A7)"
"1459",17526930711319,15172643163287,"Wood Burning Exchange Program"
"1460",12929644548631,9838290031767,"Report Non-Hazardous Road Conditions - Multnomah County"
"1461",12511463964951,13087310179223,"311 Reference Guide - IRP Public Dashboard"
"1462",12475487927703,13119341296663,"Follow up on a Stolen Vehicle Report"
"1463",12080912334743,4403576706967,"CSZ Front Desk Closure Instructions"
"1464",11463544147863,13087310179223,"Logging in Remotely to VPN & Avaya"
"1465",10967497080215,9937020154903,"Call Log to Outbound Email"
"1466",9535209511703,11574301058455,"Info on Match2 Utility Debt Relief Program (Fall 2022)"
"1467",9222934478999,15676741596951,"CLOSED - Secure Residential Treatment Program"
"1468",9201131612311,17861234474647,"Info on Condominium Ordinances and Laws"
"1469",9150557192343,10790395851159,"Info on Immigrant and Refugee Program - City of Portland"
"1470",8902055472791,9838622828823,"CLOSED -  North Portland Neighborhood Clinic"
"1471",8715588839703,8035220542359,"Info on Court Interpreters Services"
"1472",8586170872983,17893249678999,"CLOSED - Cover Oregon"
"1473",8215147974807,17865416297495,"Submit an Alcohol Business Complaint to the OLCC"
"1474",7661727820823,4403568426775,"Info on Open Burning Restrictions"
"1475",7274727919639,15200623909783,"Apply For/Terminate a Domestic Partnership"
"1476",7225100178071,4403576690839,"Request a Fire Fighter Visit, Fire Station Tour, or Belmont Firehouse and Safety Museum Tour"
"1477",7172415438359,17971094054167,"File a Consumer Complaint with the DOJ"
"1478",6987032877207,4403576258455,"Report a Missing Child (AMBER Alert)"
"1479",6853009141143,9934538072087,"Resources for Local Road Construction Updates"
"1480",6827233203991,15288281829655,"Info on Foster Grandparents Program"
"1481",6479257113751,4403576237719,"Info on Child Custody Issues"
"1482",6279701145111,4403576252695,"Info on SEED Initiatives"
"1483",6150440858135,15192330325655,"Info on Barking Dogs & Other Nuisances"
"1484",6127317991447,10638365607959,"File a Noise Complaint - Aircraft In-Flight"
"1485",4405750765591,15173422379927,"Info on Turn Self In Program (TSI)"
"1486",4405744565399,4403576257303,"Info on Notary Public (Secretary of State’s Office)"
"1487",4405744520087,4403569048727,"Info on NRT Central (Neighborhood Response Team)"
"1488",4405744275991,4403569063959,"Info on City Workforce Recruitment and Training"
"1489",4405744193303,4403576245655,"Info on State Road Conditions"
"1490",4405744183959,7222165929239,"Info on Office of Violence Prevention"
"1491",4405750541335,17972627899799,"Info on Mental Health Court"
"1492",4405744130967,15191261379607,"Contact Info for County Health Department Administration"
"1493",4405750536727,15490062083223,"Info on County Behavioral Health Division Administration"
"1494",4405744122903,4403576690455,"Info on Sharps/Syringe Disposal"
"1495",4405744074519,4403576694807,"Info on East County Dental Clinic"
"1496",4405744002839,15640942419351,"Info on County Benefits & Health Promotion"
"1497",4405743978647,15172640214551,"Info on Multnomah County Case Management Services (Developmental Disabilities)"
"1498",4405743967511,15173380422039,"Department of County Human Services Administration - Contact List "
"1499",4405743946391,15288276156055,"Info on North/NE Aging, Disability & Veterans Services Office"
"1500",4405743938327,15172148156311,"Info on County Building Security"
"1501",4405743911447,9838504456855,"Info on County Transportation Right-of-Way Permits Section"
"1502",4405750423703,15751718956311,"Info on Sanctions and Services Hearings Office"
"1503",4405750413335,15676854158103,"Info on Emancipation"
"1504",4405743746071,4403569042199,"Info on Portland SmartTrips (Walking/Biking)"
"1505",4405743659415,4403568415127,"County Commissioner District 3: Julia Brim-Edwards"
"1506",18874738329751,11497840017047,"Tree Reports: City Parks (A7)"
"1507",11731990739351,13119341296663,"Report a Stolen License Plate"
"1508",11317955701399,13087310179223,"Transferring Calls Via Conference (Avaya)"
"1509",10580990453911,9937020154903,"Outbound Requests"
"1510",9223018536471,15676854158103,"CLOSED - Reclaiming Futures Initiative - Multnomah Embrace"
"1511",8902638896151,9838622828823,"CLOSED - Alternative Housing Resources "
"1512",8715189503255,4403569074327,"CLOSED - Community Youth Hotline"
"1513",7707524949015,15172148156311,"Info on Vance Property"
"1514",7273468171927,9934538072087,"List of Emergency Response Numbers"
"1515",7225334871447,4403568426775,"Info on Outdoor Recreational Burning"
"1516",7224947201943,4403576690839,"Report Illegal Fireworks"
"1517",7172369193623,17971094054167,"Order/Opt Out Phone Books"
"1518",6986640528791,4403576258455,"Report a Drunk Driver"
"1519",6857441672087,9838290031767,"Request Road or Bridge Services - Multnomah County"
"1520",6804889265815,15288281829655,"Info on Multnomah County Money Management Program"
"1521",6798299675031,11574389240727,"Request Fire Hydrant Flow Information"
"1522",6478278688407,4403576237719,"Info on Name Changes for Minors and Adults"
"1523",6426026354967,4403576245655,"Info on County Vehicle Registration Fee (VRF)"
"1524",6277356151959,4403568434455,"Info on Portland Action Tables"
"1525",6176324799127,15192330325655,"Report an Animal Locked in a Hot, Parked Car"
"1526",6145597162775,10638365607959,"Info on Noise Review Board: PIR Subcommittee"
"1527",4405744566679,4403576257303,"Info on Homeowners Associations"
"1528",4405744521751,11578590601367,"Police Investigations Branch (PPB) - Contact List"
"1529",4405750609815,4403569063959,"Info on City Outreach, Employment & Diversity Development (People & Culture)"
"1530",4405744239639,4403576706967,"Info on CSZ Portland Building Front Desk"
"1531",4405744129815,15490062083223,"Info on County Behavioral Health Division - Quality Management"
"1532",4405750508695,4403576694807,"Info on Mid-County Dental Clinic"
"1533",4405750507415,4403576690455,"Info on Disease Update Hotline"
"1534",4405750474135,4403568427415,"Info on Multnomah County District Attorney’s Office"
"1535",4405744006935,15200623909783,"Info on Judge Availability for Weddings"
"1536",4405750456727,15640942419351,"Info on County Employee Assistance Program (EAP)"
"1537",4405743949463,15288276156055,"Info on SE Aging, Disability & Veterans Services Office"
"1538",4405743947927,15172640214551,"CLOSED - Region 1 Crisis Diversion Services - Developmental Disabilities"
"1539",4405743941911,15172643163287,"Info on Multnomah County Weatherization Program"
"1540",4405743907479,15173422379927,"Info on DUII Evaluation"
"1541",4405743895447,15751718956311,"Info on Reduced Supervision Team"
"1542",4405750403735,8035220542359,"Info on Courthouse Child Care (CourtCare)"
"1543",4405743744279,4403569042199,"Info and Resources for Bicyclists"
"1544",4405743657879,4403568415127,"County Commissioner District 4: Lori Stegmann"
"1545",19377875232151,11497840017047,"Tree Report: City Property, non-Parks (A7)"
"1546",12475731247767,13119341296663,"Checks on Whether a Vehicle Has Been Reported as Stolen"
"1547",11623232077719,4403576706967,"CSZ Portland Building Front Desk Email"
"1548",10940410139287,13087310179223,"Language Line Solutions Guide"
"1549",10636186510103,4403569042199,"Info on City Bicycle Planning/Projects"
"1550",9967829457431,9937020154903,"311 Customer Service Form"
"1551",9689326299159,9837542049559,"Info on YWCA of Greater Portland"
"1552",9224255652759,15172640214551,"CLOSED - Community Options - Developmental Disabilities"
"1553",8901466979607,15172148156311,"CLOSED 2013 - County Materials Management"
"1554",8714633823511,9838622828823,"CLOSED - Community Residential Siting Program"
"1555",8371631279511,4403576245655,"Info on DMV Deaf or Hard of Hearing Designation"
"1556",8298334726039,15676854158103,"CLOSED - Early Intervention Unit for Delinquency Prevention (EIU)"
"1557",7555317276311,17620040339991,"Info on Move-in Multnomah"
"1558",6805148014999,7893301858071,"Info on Medicare"
"1559",6773713637783,11574305188631,"Pay a Water, Sewer, or Stormwater Bill"
"1560",6628019356183,4403569063959,"Info on Public Service Loan Forgiveness"
"1561",6610385579671,4403576704151,"Request an EMS (Patient) Report"
"1562",6505238810263,15288281829655,"Info on Multnomah County Hoarding Task Force"
"1563",6478083086871,4403576237719,"Info on Adoption Records"
"1564",6427821890199,4403568426775,"Report Backyard Burning - Portland"
"1565",6176108376727,15192330325655,"Report a Dog or Cat Bite - Multnomah County"
"1566",6145698247447,10638365607959,"Info on Noise Review Board"
"1567",5920878377367,4403576258455,"Info on Gun Sales and Transfers"
"1568",5326451916183,4403569077783,"Info on Vehicle Inspection Team (VIT)"
"1569",4405750730263,11578515292183,"Police Operations Branch (PPB) - Contact List"
"1570",4405744384407,6018702538391,"General non-City non-County questions"
"1571",4405744185239,4403568434455,"Info on PDX Clean & Green Action Table"
"1572",4405750521111,4403576690455,"Info on West Nile Virus"
"1573",4405744078359,4403576694807,"Info on North Portland Dental Clinic"
"1574",4405750499735,15490062083223,"Info on County Addiction Services"
"1575",4405750459543,15200623909783,"Info on US Passport Offices"
"1576",4405743988247,15640960380695,"Info on County Labor Relations"
"1577",4405743966103,15288276156055,"Info on West Aging, Disability & Veterans Services Office"
"1578",4405743919255,9838290031767,"Info on Multnomah County Transportation Sign Services"
"1579",4405743888279,15751718956311,"Info on Adult African American Supervision Program"
"1580",4405743882007,15173422379927,"Info on Pretrial Services Program (PSP)"
"1581",4405743855767,8035220542359,"Info on Courthouse Tours"
"1582",4405750402711,17976803738903,"Info on Court Personnel"
"1583",4405743656727,4403568415127,"Info on the Multnomah County Board Clerk"
"1584",19376726328727,11497840017047,"Identify Heritage Trees on A7 GIS"
"1585",17387499650711,4403576237719,"Info on Oregon's Red Flag / Gun Safety Laws / Extreme Risk Protection Orders (ERPO)"
"1586",12904023982999,15288276156055,"Info on Multnomah County ADS Transition and Diversion"
"1587",11579839212567,4403576706967,"CSZ Teams Chat with City Staff"
"1588",10642407347863,9937020154903,"Leaving Feedback on Zendesk Articles"
"1589",10634891926423,4403569042199,"Info on Bicycle Locker Rentals"
"1590",9225340464023,6018702538391,"Info on City Repair Project"
"1591",9045352093463,4403576258455,"Info on Tobacco Retail Licenses and State Cigarette Tax Program"
"1592",8449429880599,15173380422039,"Info on Multnomah Idea Lab (MIL)"
"1593",8378093369111,10790899428247,"Info on Portland's Diversity and Civic Leadership (DCL) Program"
"1594",8216378179351,4403569063959,"Info on City Employee Travel Policy"
"1595",7245190573335,4403576245655,"Report a Medically-At-Risk Driver"
"1596",6828628044055,17620235140759,"Info on the Vital Aging Task Force"
"1597",6584032846999,13087310179223,"Submit a Request Through PDX Reporter"
"1598",6454152522135,4403576238615,"Info on the David Campbell Firefighter's Memorial"
"1599",6197397860503,15192330325655,"Report a Dead Animal on Private Property"
"1600",5901238402327,4403576225815,"Info on Non-Injury Car Accidents"
"1601",4942396486423,4403576713623,"Info on Hygiene Stations / Portable Toilets"
"1602",4405750791063,11574364082839,"Info on Utilities Customer Information System CIS"
"1603",4405744518423,11578689007383,"Police Services Branch (PPB) - Contact List"
"1604",4405750562967,4403568434455,"Info on Last Thursday (Alberta Street)"
"1605",4405744137879,15490062083223,"Info on Mental Health Services - Forensic Diversion Program"
"1606",4405744071191,4403576694807,"Info on Northeast Dental Clinic"
"1607",4405750504727,4403576690455,"Info on Head Lice Info Line"
"1608",4405744010903,4403568426775,"Info on Oil or Gasoline Tank Decommissioning"
"1609",4405750462743,17620235140759,"Info on County Office of Diversity, Equity, and Affirmative Action"
"1610",4405750460951,15640970462615,"Info on County Job Hotline"
"1611",4405743884695,15751718956311,"Info on Domestic Violence Probation and Parole Office"
"1612",4405743879959,15173422379927,"Info on START (Success Through Accountability Restitution and Treatment Court)"
"1613",19618114489239,11497840017047,"General A7 Guidelines"
"1614",12476536051479,13119341296663,"Report a Hit and Run (No Injuries)"
"1615",11316715573399,10761834248471,"Report an Issue with the City's Website"
"1616",11084641903895,9937020154903,"Making Personal Macros"
"1617",10633736586135,4403569042199,"Info on Portland Bike Rules and Laws"
"1618",9204085789463,6018702538391,"Info on Community Action Programs"
"1619",9170008114711,9839187382423,"Info on Hands on Greater Portland"
"1620",9073227280151,13087310179223,"City Staff Oregonian Subscription Login"
"1621",8901595789335,4403568434455,"Former Mayor Tom Potter (Term Ended 12/31/08)"
"1622",8216111351319,4403569063959,"Info on City Employee Inclement Weather Information"
"1623",7871496394135,4403576246039,"Info on Office of Community & Civic Life"
"1624",6983386517271,4403576258455,"Info on Gaming Enforcement (Oregon State Police)"
"1625",6829791121559,7893301858071,"Info on The Lifespan Respite Care Program"
"1626",6426590100631,4403576245655,"Apply for a Wounded Warrior Sticker"
"1627",6199391457047,4403568426775,"Info on the Bottle Bill"
"1628",6175110417303,15192330325655,"Report a Dead Animal on Public Property"
"1629",6126061873175,10791403392279,"Info on Fire Extinguishers, Fire Protection Systems and Certificate of Fitness Test for Certificate Holders - Fire Bureau"
"1630",4914293470359,4403576713623,"Request Campsite Cleanup and Garbage Removal / Report Complaints About Removals"
"1631",4405744636055,11574506576535,"Info on Water Districts Locations"
"1632",4405744513687,11578470586775,"Info on Portland Police Chief’s Office (PPB)"
"1633",4405744133015,8034898844439,"Info on Coalition of Community Health Clinics"
"1634",4405744124439,15490062083223,"Info on Multnomah County Behavioral Health Adult Safety Net Programs"
"1635",4405744109847,4403576694807,"Info on Rockwood Community Dental Clinic"
"1636",4405750503191,4403576690455,"Info on Multnomah County Tuberculosis Clinic"
"1637",4405750480023,4403576237719,"Info on Civil Commitments (Mental Health)"
"1638",4405744005783,15640942419351,"CLOSED - County Employee Home Ownership Services (Human Resources)"
"1639",4405750419863,15751718956311,"Info on DUI Supervision/Monitored Misdemeanor Probation (MMP)"
"1640",4405750416919,15173422379927,"Info on Local Control, Pre-Sentence Investigations and Hearings Units"
"1641",4405743661207,17620040339991,"Info on Joint Office of Homeless Services (JOHS)"
"1642",12817968525207,13119341296663,"Info on Reporting Attempted Theft"
"1643",11787430369431,13087310179223,"311 Frequent Callers (Other Other)"
"1644",11288251252887,4403569040535,"Request 311 Program Materials/Swag"
