"","id","section_id","name"
"673",6044981394455,9941189837719,"Info on Contract Administration (PBOT)"
"674",6026288693911,4403569094551,"Info on PBOT Stewardship Program"
"675",6026282380951,4403569094551,"Info on Combined Publication Box Permits"
"676",6025936159767,4403569094551,"Apply for a Street Painting Permit"
"677",6024022104599,4403569101463,"Info on Portland Pathway Program (Urban Trails)"
"678",6023463915415,4403569101463,"Info on Play Streets Permits"
"679",6023292578199,4403569101463,"Info on Spaces to Places Permits"
"680",6023084139671,4403569101463,"Apply for a PARK(ing) Day Permit"
"681",6018951557911,9940924520727,"Info on Fast Stop 5-Minute Parking Zones "
"682",6018821620503,9940924520727,"Info on Traffic Intervention Strategies for Reducing Gun Violence/Crime "
"683",6018256039703,9940924520727,"Info on Slow Streets/Safe Streets Program"
"684",6018224363159,9940924520727,"Discontinued - Temporary Business Pickup/Drop-off Parking Space"
"685",6018010317335,9940924520727,"Report Damaged Temporary Orange Barrel or Sign (Slow Streets)"
"686",6017710787223,4403569094551,"Info on Portland Public Plazas"
"687",5996806481175,4403576712087,"Info on Paid Parental Leave for City Staff (FMLA)"
"688",5923570397207,4403576256535,"Info on Community Waste Collection Events"
"689",5920310056343,17539540007959,"Info on Gun Disposal"
"690",5903480808599,17539540007959,"Info on Home Premise Check (Vacation)"
"691",5901491074967,14449886770839,"Info on RV Pollution Prevention Program"
"692",5875614069271,17539540007959,"Report an Abandoned Auto - Multnomah County"
"693",5875504427927,5773356402711,"Report an Abandoned Auto - Gresham"
"694",5871778605719,17539540007959,"Info on Multnomah County Sheriff's HOPE Team"
"695",5871116469015,8035491930519,"Info on Trimet"
"696",5870853438615,8035491930519,"Info on Transit (Trimet) Police"
"697",5846554893079,4403576246551,"Request an ADA Accommodation"
"698",5846319495191,4403576246551,"Report Discrimination Complaint (ADA Title 2 - Disability and Civil Rights Title 6)"
"699",5828991809431,4403576740887,"Info on Single-Use Plastic Bag Ban (Ban the Bag)"
"700",5828547510551,4403569068183,"Info on Renewable Fuels Standard"
"701",5828123860503,11496401671831,"Info on Smart City PDX"
"702",5827809897367,4403576740887,"Info on Single-Use Non-Recyclable Plastics Reduction Strategy (Including Plastic Straws)"
"703",5827278128791,11793982412567,"Info on Portland Clean Energy Fund (PCEF)"
"704",5827057780247,11793828179223,"Info on Residential Infill Project Hotline (RIP)"
"705",5826448087831,4403576229527,"Info on Shelter to Housing Continuum"
"706",5824190991383,10638365607959,"Report Illegal Dumping/Trash on Private Property"
"707",5823766570007,4403576256535,"Report Illegal Dumping in Public Areas (RID Patrol)"
"708",5776498673559,4403576740887,"Info on Business Garbage and Recycling Policies - BPS"
"709",5776309376023,4403576740887,"Become a Waste Hauler - City of Portland"
"710",5775309172119,4403576706199,"Info on Cut Through the FOG (Fats, Oils, Grease) Program"
"711",5773370805783,5773356402711,"Report Spills or Illegal Dumping - Gresham"
"712",5772903098007,5772532606743,"Report Oil Spill Hazardous Materials Spill - State of Washington"
"713",5772481288599,5772392705815,"Report a Spill or Leak - Clackamas County"
"714",5753307823127,4403569065111,"Report a Sewer Backup Issue"
"715",5753157728663,4403569065111,"Adopt a Storm Drain"
"716",5748267239447,4403568414615,"Test article for template"
"717",5748136991511,5748031941399,"FAQ Template"
"718",5725816576407,4403569078551,"Info on Original Art Mural Project Permits"
"719",5703127757591,4403569091735,"Info on Accessory Dwelling Unit (ADU) Permits"
"720",5702617263127,10638365607959,"Info on Adult Care Home Inspection Permits"
"721",5700843247511,4403569090839,"Info on BDS Metro Reports"
"722",5700464608151,4403569048343,"Info on Standard Construction Specifications (2010 Edition)"
"723",5682026320151,4403569078551,"Apply for a Home Project Permit Online (DevHub)"
"724",5681599063575,4403569078551,"Info on Systems Development Charges (SDC)"
"725",5672063070103,7222165929239,"Info on Safe Rest Villages (SRV)/ Shelter Services"
"726",5604919037079,4403576734103,"Info on Sidewalks"
"727",5577510238871,4403576740887,"Info on Sustainability at Work Program"
"728",5575484321687,4403569096087,"Report Tree Branches Blocking Streetlights"
"729",5575461943831,4403569096087,"Request a New Streetlight"
"730",5477115287831,13119341296663,"Police - Public Safety Non-Emergency Response Line"
"731",5304983834903,4403569090455,"Request Name Record/Background Check (Police Contact Records)"
"732",5019652068247,4403569090455,"Request a Copy of a Police Report"
"733",5017014243351,4403569042199,"Report problem with an E-Scooter"
"734",4916605834135,4403576713623,"Report a Campsite on Public Property (IRP)"
"735",4758906897431,4420999595159,"Info on Washington Park Permits"
"736",4758601912855,4662992412183,"Pay to Park at Washington Park & Pittock"
"737",4758415164567,4662992412183,"Payment FAQs - Washington Park & Pittock"
"738",4757731229079,4420999595159,"Oversize & Government Vehicle Parking - Washington Park & Pittock"
"739",4757582711831,4420999595159,"Overnight Parking - Washington Park & Pittock"
"740",4756487434007,4420999595159,"Lost and Found / Missing Items - Washington Park"
"741",4755492649111,4663227919127,"Received Parking Citation in Error - Washington Park & Pittock"
"742",4663329354135,4420999595159,"ADA Parking in Washington Park & Pittock"
"743",4663281285911,4662992412183,"Parking Refunds - Washington Park & Pittock"
"744",4663206588951,4663227919127,"Appeal a Parking Citation - Washington Park & Pittock"
"745",4663123301911,4662992412183,"Step-by-Step Meter How-To"
"746",4663066093975,4662992412183,"Stuck Card & Coin Jam Issues - Washington Park & Pittock"
"747",4420971758103,4420999595159,"Information and FAQs - Washington Park"
"748",4405750789783,11547002770583,"Info on Water Bureau Administration"
"749",4405750788503,11574508750743,"Info on Fire Hydrant Locations"
"750",4405750787479,11574443677207,"Info on Water Maintenance Administration Office"
"751",4405750786327,11574389240727,"Info on Fire Hydrant and Bulk Water Permits"
"752",4405744639127,11549393337111,"Info on Water Meter Readers"
"753",4405744637463,11574364082839,"Info on Water Bureau Customer Service Division"
"754",4405744632599,11547410378775,"Info on Water Bureau Land Use Reviews"
"755",4405744631319,11547410378775,"Info on Portland Hydroelectric Project"
"756",4405744629527,11547410378775,"Info on Water Service Availability"
"757",4405744628375,11547410378775,"Info on Water Bureau Development Services"
"758",4405744626583,11547410378775,"Info on Water Meter Connection Permits"
"759",4405744625047,4403576729751,"Info on Backflow Prevention and Cross-Connection Control Program"
"760",4405744621335,11574301058455,"Apply for Financial Assistance: Water, Sewer, or Stormwater Bill"
"761",4405744619671,4403576729111,"Info on Sandy River Pump Station/Dodge Park"
"762",4405750779671,4403576727831,"Info on Water Bureau Communications and Outreach"
"763",4405744617623,4403569080343,"Info on Regional Water Supply Plan (RWSP)"
"764",4405750777367,4403569080343,"Archive for Water Quality Advisory Committee"
"765",4405744615831,11549429548055,"Info on Drinking Fountain Maintenance"
"766",4405744612887,4403576714007,"Info on Water Quality aka ‘The Water Line’"
"767",4405744611479,4403569063575,"Info on Water Bureau Security"
"768",4405744610071,4403569063575,"Info on Water Bureau Emergency Operations Center"
"769",4405744608663,11547002770583,"Info on Water Bureau Administrator’s Office"
"770",4405744605975,11574391043607,"Info on Water Bureau Engineering"
"771",4405750773015,4403576729751,"Info on Water Pressure Variation"
"772",4405744603415,11574305188631,"Info on Sewer Rates"
"773",4405744601111,4403569053847,"Info on BIG Program"
"774",4405744599959,4403569053847,"Info on Bull Run Watershed and Reservoirs"
"775",4405744598295,4403569053847,"Info on Water Conservation Education and Outreach"
"776",4405744597015,4403568452375,"Info on US Customs Service"
"777",4405750771351,4403568452375,"Info on U.S. Citizenship and Immigration Services (USCIS)"
"778",4405750769943,4403576259863,"Info on United States Postal Service (USPS)"
"779",4405750768791,4403576231063,"Info on Traffic Court Payments and Citations"
"780",4405744591639,4403568450711,"Info on Metro Supportive Housing Services Program Tax"
"781",4405750767511,12727789632151,"Register as a Sex Offender"
"782",4405744590103,4403576258455,"Info on Oregon State Police (OSP)"
"783",4405744586647,4403576258071,"Info on Social Security Administration (SSA)"
"784",4405744585495,17539533051031,"Info on Sheriff’s Office Logistics Unit"
"785",4405744581911,17539551770135,"Info on Multnomah County Sheriff’s Office Administration"
"786",4405744580375,17539488352023,"Info on Multnomah County Courthouse Lost and Found"
"787",4405744579095,17539501975831,"Info on County Jail Chaplains"
"788",4405744577943,17539533051031,"Info on County Alarm Unit"
"789",4405744576791,17539540007959,"Info on County Abandoned Autos Section"
"790",4405750763543,17539540007959,"Info on Sheriff’s Office Enforcement Division Headquarters"
"791",4405744575383,17539540007959,"Info on Civil Process Servers"
"792",4405744573847,17539533051031,"Info on Concealed Handgun Unit - Multnomah County Sheriff"
"793",4405750762391,17539488352023,"Info on Multnomah County Courthouse Jail"
"794",4405744572439,17539533051031,"Info on Inverness Jail"
"795",4405744571287,17539488352023,"Info on Multnomah County Detention Center/Jail at the Justice Center"
"796",4405750760983,17539501975831,"Info on Sheriff’s Office Auxiliary Services"
"797",4405744568215,17539488352023,"Info on Multnomah County Jails - Contact List"
"798",4405750759063,17539533051031,"Info on Sheriff’s Property Control Unit"
"799",4405750757527,4403576257303,"Secretary of State, LaVonne Griffin-Valade"
"800",4405750756247,4403576256535,"Info on Metro Natural Gardening and Composting"
"801",4405750754967,4403576256535,"Info on Transfer Stations"
"802",4405744561815,4403576256535,"Info on Metro Recycling Information Hotline"
"803",4405744560407,17971729714839,"Info on Multnomah County Court Records"
"804",4405750752535,9838228854551,"Info on Sellwood Bridge Construction"
"805",4405744558615,11577265627799,"Info on Portland Film Office"
"806",4405744557463,11577265627799,"Info on Urban Renewal Districts"
"807",4405744555799,11577265627799,"Prosper Portland Project - Contact List"
"808",4405744554391,11577265627799,"Info on Prosper Portland - Public Affairs Office"
"809",4405744553111,11577265627799,"Info on Prosper Portland - Urban Development"
"810",4405750750231,11577265627799,"Info on Prosper Portland Commission Meetings"
"811",4405750749207,11577265627799,"Info on Prosper Portland (formerly Portland Development Commission (PDC))"
"812",4405744551319,11577283019415,"Info on Prosper Portland - Public Participation and Outreach"
"813",4405750748183,11577284914711,"Info on Youth Employment and Involvement Support and Funding"
"814",4405744549527,11577284914711,"Info on Prosper Portland - Workforce Development"
"815",4405750746519,11577284914711,"Info on Lents Urban Renewal Project"
"816",4405750745111,11577284914711,"Info on Prosper Portland - Prosperity Investment Program"
"817",4405744547479,11577306491415,"Info on Prosper Portland Business Finance Programs - Small Business Loans"
"818",4405744545687,11577341103767,"Info on Prosper Portland Human Resources"
"819",4405750742807,4403568449047,"Info on Probate Department"
"820",4405744542743,4403568448663,"Contact Info for Portland Public Schools"
"821",4405750741399,11496831696279,"Info on Portland Housing Bureau’s Rental Services Office (RSO)"
"822",4405744541335,11496831696279,"Housing Connections - Discontinued as of 9/25/15"
"823",4405744540055,11496835746967,"Info on Portland Housing Bureau (PHB)"
"824",4405750739991,11497291284887,"Info on Portland Housing Advisory Commission"
"825",4405750738711,11578014724503,"Info on Housing Development Assistance for Low Income Housing"
"826",4405744538007,11577654171671,"Info on City Housing Development Finance Program"
"827",4405744536343,11577654171671,"Info on City Home Repair Programs"
"828",4405750737047,11577654171671,"Info on City Inclusionary Housing Program"
"829",4405744532631,11577654171671,"Info on Limited Tax Exemption Programs - City"
"830",4405750734743,4403568420631,"Info on Portland Children’s Levy"
"831",4405750733719,4403568447383,"Info on Portland Bureau of Emergency Management (PBEM)"
"832",4405750732311,4403568447383,"Info on City Disaster Emergency Preparedness"
"833",4405744526871,4403568447383,"Info on City Neighborhood Emergency Teams (NET) and COAD"
"834",4405750722455,4403576741783,"CLOSED - Police Youth Services Branch"
"835",4405744511255,4403576741783,"CLOSED - School Resource Officers (Portland Police)"
"836",4405750721047,4403569100951,"Info on Speeding Concerns - Portland Police Traffic Division"
"837",4405744509591,4403569100951,"Info on PPB Traffic Division"
"838",4405750717719,4403569100951,"Info on Photo Radar/Red Light Camera Program"
"839",4405744504471,4403569100951,"INACTIVE - Combat Auto Theft (CAT) Program"
"840",4405744502935,12727789632151,"Info on PPB Canine Unit"
"841",4405750715031,4403569090455,"Info on PPB Records Division"
"842",4405750712855,4403569090455,"Info on PPB Auto Records (Towed/Stolen/Missing)"
"843",4405744499479,4403576724247,"Info on PPB Property Room/Property Evidence Division"
"844",4405750710551,4403569086359,"Info on Police Professional Standards Division"
"845",4405744497687,4403576721175,"Info on PPB Personnel Division"
"846",4405744496023,4403569090455,"File a Police Report - Portland"
"847",4405744494487,4403569075095,"Info on PPB North Precinct"
"848",4405750708887,4403576708759,"Info on Fingerprinting Services"
"849",4405750707735,11498454144279,"Info on City Alarm Unit"
"850",4405744492695,11578747020951,"Info on Police Special Victims Unit (SVU)"
"851",4405744491543,4403576707991,"Info on PPB Family Services Unit"
"852",4405744487191,9221115762199,"Info on Rose City Self-Defense"
"853",4405744484631,4403576702871,"Info on East Precinct Neighborhood Response Team Officers (NRT)"
"854",4405750705303,4403576702871,"Info on PPB East Precinct"
"855",4405744483095,12727789632151,"Info on PPB Narcotics & Organized Crime Unit (Drugs and Vice Division)"
"856",4405744481303,12727789632151,"Report a Drug House or Drug Activity - Portland"
"857",4405750703511,4403569060119,"Police Detective Division (PPB) - Contact List"
"858",4405750702231,12727789632151,"Info on PPB Behavioral Health Unit"
"859",4405744478871,4403569048727,"Info on PPB Central Precinct"
"860",4405744477207,4403568446743,"Info on Metro Natural Resources Planning"
"861",4405744475671,4403568446743,"Info on Metro Transportation Planning & Projects"
"862",4405744474391,4403568446743,"Info on Metro Land Use Planning"
"863",4405744473111,4403576251927,"Info on Metro Historic (Pioneer) Cemeteries"
"864",4405750700055,11497924848791,"Portland Parks Recreation Services Division - Contact List"
"865",4405744471575,11497890259991,"Info on Portland Public Restrooms"
"866",4405750698775,11497919230359,"Info on Parks Assets & Development Division"
"867",4405750697751,11497965760663,"Info on Portland Parks Administration"
"868",4405744469655,11497790038039,"Info on Urban Forestry"
"869",4405750695959,11497836209815,"Info on Parks Land Stewardship Division - Natural Areas and Trails"
"870",4405744467607,11497965760663,"Info on Portland Parks Foundation"
"871",4405744466071,11497965760663,"Info on Parks Director’s Office"
"872",4405744464663,4403569111831,"Info on Pittock Mansion"
"873",4405750694167,11497790038039,"Info on Urban Forestry Commission"
"874",4405750692887,4403569111831,"Info on Parks Maintenance - Rose Unit and Washington Park"
"875",4405744459671,4403569111831,"Info on Parks Maintenance - Forest Park, Hoyt Arboretum"
"876",4405750690455,4403569111831,"Info on Hoyt Arboretum"
"877",4405750689047,4403569111831,"Info on Parks - West Zone"
"878",4405744457111,4403576731159,"Info on City Parks Sports Programs"
"879",4405744455959,4403576731159,"Info on Delta Park/Owens Sports Complex and Buckman Field"
"880",4405750687127,4403576731159,"Info on Portland Parks Tennis"
"881",4405750685975,4403576731159,"Info on Sports Information Line"
"882",4405750684695,4403576731159,"Info on Portland Parks Aquatics Program"
"883",4405750683671,4403576731159,"Info on (Northeast) Community Swim Pools "
"884",4405744452759,4403576731159,"Info on (North) Community Swim Pools"
"885",4405750682519,4403576731159,"Info on (West) Community Swim Pools"
"886",4405744451095,4403576731159,"Info on (Southeast) Community Swim Pools"
"887",4405750680599,4403576731159,"Info on Portland Metro Softball Association"
"888",4405750679447,4403576731159,"Info on Interactive Fountains and Splash Pads"
"889",4405744448151,4403576728727,"Info on Parks Teen Recreation/TeenForce"
"890",4405744445847,4403576728727,"Info on Parks Senior/Life Long Recreation "
"891",4405744444567,4403576728727,"Info on Parks Adaptive and Inclusive Recreation"
"892",4405744440343,4403576728727,"Info on Parks Citywide Recreation Services"
"893",4405744438679,9944870088855,"Info on Parks Non-Park Use Permits"
"894",4405750675863,4403576691863,"Info on Parks Information & Outreach"
"895",4405744437399,9944868636951,"Info on Portland Parks Boat Ramps, Docks, and Riverplace Marina"
"896",4405744436247,9944868636951,"Info on Sports & Activities (Portland Parks and Recreation)"
"897",4405744435095,9944868636951,"Info on Public Events Permits - Parks"
"898",4405750674327,9944868636951,"Info on Parks Customer Service Center"
"899",4405744433303,4403569079575,"Info on Portland Parks SDCs"
"900",4405744431767,4403569079959,"Info on Parks Planning"
"901",4405744429975,4403569079063,"Info on Portland International Raceway (PIR)"
"902",4405750672663,4403569078167,"Info on Parks Capital Projects (Design and Development)"
"903",4405750671511,9944563113751,"Info on Horticultural Services - Parks"
"904",4405744428439,9944266268695,"Info on Environmental Education -  Portland Parks"
"905",4405744426775,9944266268695,"Info on Community Gardens Program"
"906",4405750670103,9944766892439,"Info on Parks Security, Public Safety / Park Rangers"
"907",4405750668695,9944766892439,"Info on Dogs Off-Leash Program in Parks"
"908",4405750667543,4403569067543,"Info on City Golf Courses"
"909",4405744424471,4403569063191,"Info on Vera Katz Eastbank Esplanade"
"910",4405744423191,4403569063191,"Info on Leach Botanical Garden"
"911",4405750666263,4403569063191,"Info on Crystal Springs Rhododendron Garden"
"912",4405744421271,4403569063191,"Info on Parks - South/East Zone"
"913",4405750664727,4403569063191,"Info on Parks - North/Northeast Zone"
"914",4405744419223,4403576691863,"Info on Oregon Rail Heritage Foundation/Friends of SP 4449"
"915",4405750663319,4403576691863,"Info on Parks Volunteer Program"
"916",4405750662167,4403576691223,"Info on Southwest Community Center"
"917",4405750661143,4403576691223,"Info on Matt Dishman Community Center"
"918",4405744417047,4403576691223,"Info on East Portland Community Center and Pool"
"919",4405744414103,4403576691223,"Info on Peninsula Park Community Center"
"920",4405744411287,4403576691223,"Info on Woodstock Community Center"
"921",4405750659223,4403576691223,"Info on Montavilla Community Center"
"922",4405744407959,4403576691223,"Info on Mt Scott Community Center"
"923",4405744404503,4403576691223,"Info on St. Johns Community Center"
"924",4405744402199,4403576691223,"Info on Charles Jordan Community Center"
"925",4405744400535,9944870088855,"Info on Parks Maintenance - Central Stores"
"926",4405744398359,4403569045527,"Info on Parks Professional Repair & Maintenance Services (PRMS, Central Services) at Mt Tabor Yard"
"927",4405750657431,4403576686743,"Info on Simon and Helen Director Park"
"928",4405744396055,4403576686743,"Info on Oaks Pioneer Church"
"929",4405744393239,4403576686743,"Info on Multnomah Arts Center"
"930",4405750650647,4403576686743,"Info on Community Music Center"
"931",4405744385815,4403568444183,"Info on Parking Court Payments and Citations"
"932",4405744383255,4403568442135,"Info on Oregon Health Authority"
"933",4405744381847,17893289082263,"Info on Oregon State Hospital"
"934",4405744380567,17909859433239,"Order State of Oregon Vital Records"
"935",4405744378391,17911212310551,"Info on Oregon Medical Marijuana and Dispensary Programs"
"936",4405750644759,17893249678999,"Info on Oregon Health Plan"
"937",4405744375191,17619855106839,"Info on Multnomah County Office of Sustainability"
"938",4405750641431,10761834248471,"City Web Administrators - Contact List"
"939",4405744373655,4403569092503,"Info on Portland Sign"
"940",4405750640151,10127100999575,"Info on Office of Management and Finance (OMF)"
"941",4405744371479,10127100999575,"List of City Media Contacts"
"942",4405744370327,10148698443031,"Info on Division of Asset Management (DAM) - City"
"943",4405744369175,4403568439703,"Info on City Employee Combined Charitable Campaign "
"944",4405750636567,10127100006935,"OMF City Bureau of Revenue and Financial Services - Contact List"
"945",4405744357783,4403569071383,"Info on Civil Service Board"
"946",4405744356247,10127099181207,"Info on City Human Resources Director’s Office (BHR)"
"947",4405744354967,10127100999575,"Info on City Chief Administrative Officer (CAO)"
"948",4405744353047,4403569092503,"Info on City Debt Management Program"
"949",4405744351255,4403569105815,"Info on City Treasury Division"
"950",4405744346647,11735511660823,"Info on the Bureau of Technology Services Help Desk (BTS)"
"951",4405744345367,4403569093783,"Info on the City's Risk Management Division"
"952",4405744344215,4403569092503,"Info on City Arts Tax (& How to Pay)"
"953",4405750632471,23064776969367,"Info on Payday Lender Permits"
"954",4405750631191,4403569092503,"Info on City Revenue Division"
"955",4405750629911,23064776969367,"Info on Social Games Permits"
"956",4405744341911,4403569092503,"Look up a Business on the ""New Business List"""
"957",4405744340503,4403569092503,"Info on City License and Tax Division"
"958",4405744339095,4403569092503,"Info on Municipal Liens"
"959",4405744337943,4403569092503,"Info on City Accounts Receivable"
"960",4405750628759,4403569092503,"Info on Transient Lodgings Tax"
"961",4405744336407,23064776969367,"Info on Pay and Park and Non-Pay Private Parking Facilities Program"
"962",4405750627351,23064776969367,"Info on Secondhand Dealer Permits"
"963",4405744334871,4403569092503,"Info on Downtown Business Improvement Districts Fee Collection"
"964",4405744333335,23064776969367,"Apply for an Amusement Device Permit"
"965",4405744331799,4403569092503,"Info on City of Portland Business License Taxes"
"966",4405744330647,4403569085975,"Info on Language Translation and Interpretation Citywide Contracts"
"967",4405744325655,4403569085975,"Info on Equity, Diversity and Inclusion in Contracting - City Procurement"
"968",4405744321175,4403569085975,"Info on Vendor Resources - City Procurement"
"969",4405744318359,4403569085975,"Info on City Procurement Services Division "
"970",4405744316951,10761927324823,"Info on Printing and Distribution Services Program"
"971",4405744313623,10761927324823,"Info on City Graphics and Digital Printing"
"972",4405744310807,10761927324823,"Info on City Copy Machines"
"973",4405750623383,10761927324823,"CLOSED - 1900 Bldg Printing and Distribution Office"
"974",4405750621975,10761927324823,"Info on City Mail Center"
"975",4405744307095,4403569071383,"Info on City Labor Relations"
"976",4405744304279,10761982949783,"Info on City Video Specialist"
"977",4405744299927,10761982949783,"Info on City Communications Services Accountant"
"978",4405750620183,10761927324823,"Info on City Employee Cell Phones & Pagers"
"979",4405750618775,10761982949783,"Info on City Telecommunications"
"980",4405744297239,10761982949783,"Info on City Radio Shop"
"981",4405750617623,10761921909527,"Info on 800 MHZ Radio System"
"982",4405744295575,4403576712087,"Contact List for City Payroll"
"983",4405750614679,4403569068695,"Info on Land Use Hearings"
"984",4405744294167,4403569068695,"Request a Tow Appeal Hearing"
"985",4405744292631,4403576709783,"Info on City Grants Management Compliance"
"986",4405750613399,4403576706967,"Info on 1900 Building Facilities Maintenance"
"987",4405744286871,4403576706967,"Info on Union Train Station"
"988",4405744285463,4403576706967,"Info on City Facilities Recycling"
"989",4405744283927,4403576706967,"Info on City Custodial Services (Relay Resources)"
"990",4405744282775,4403576706967,"Info on City Elevators"
"991",4405744281623,4403576706967,"Info on City Facilities Services Dispatch"
"992",4405744279319,4403576706967,"Info on City Security"
"993",4405744277783,4403576706967,"Info on City Facilities Services"
"994",4405744273687,10127099181207,"Info on City Bureau of Human Resources (BHR)"
"995",4405744271127,4403576703255,"Info on Enterprise Business Solution Office"
"996",4405744269335,4403576687255,"Info on City Deferred Compensation Program"
"997",4405744268055,4403576689943,"Info on City Classification and Compensation Unit"
"998",4405744266647,4403576689559,"Info on CityFleet First and Jefferson Garage"
"999",4405750608407,4403576689559,"Info on CityFleet Repair Garages"
"1000",4405750606999,4403576689559,"Info on CityFleet Services"
"1001",4405744264599,4403576689559,"Info on CityFleet Body and Paint Shop"
"1002",4405750604183,4403576689559,"Info on Vehicle Auctions"
"1003",4405750603031,4403576689559,"Info on Kerby Garage"
"1004",4405744261783,10761834248471,"Info on City Corporate Geographic Information System"
"1005",4405744260247,4403576687255,"Info on City Fitness Center"
