"","id","section_id","name"
"1",23188696102039,13087329420567,"CSR Protocol: Interrupt and Redirect"
"2",23174106730391,20708256067863,"Things to check when you’re taking a permit request."
"3",23164468828951,23011418682519,"Site Visit Procedures"
"4",23042911795735,4403569094551,"When to Assign Permits w/ Parking for Review"
"5",23031027135255,13087310179223,"Mittens for Kittens (Joanna's test article)"
"6",23011564396823,23011454232343,"placeholder ROW"
"7",23011588321047,23011422285335,"placeholder ROW"
"8",23011540146455,23011418682519,"placeholder ROW"
"9",22986068255511,4403569078551,"CSZ Public Social Service Phone"
"10",22975729802263,17620040339991,"Coordinated Access for Homeless Moving into Transitional or Permanent Housing"
"11",22975716445719,20831370646423,"TSUP Response to Dangerous Buildings"
"12",22974992792599,20831370646423,"Coordinating with PBOT Capital Improvement Projects"
"13",22908363587991,9915532199319,"Guide Access for end-users"
"14",22831760977687,4403568414615,"211 FAQs"
"15",22813170639255,23040095793687,"test article"
"16",22770032572055,9940774574487,"Info on Towing Hardship Program"
"17",22745976954135,13087310179223,"Submitting SAP Requests"
"18",22719718880151,22719715834007,"Placeholder: TSUP Compliance"
"19",22716408914199,10761927324823,"CSZ Sending Outgoing Mail and Interoffice"
"20",22688828410135,22348906133911,"Zendesk Tips and Tricks"
"21",22352875429143,22348906133911,"Processing Applications in Zendesk"
"22",22349568575255,20831390960919,"Intersection Permits"
"23",22349183215511,20619546704919,"Placeholder - Notification Permits"
"24",22349146174231,20629586788759,"Placeholder - Amanda Permits"
"25",22216683797015,20831390960919,"Working Overhead"
"26",22215342955671,20831390960919,"Closures on Permit vs Closures on Traffic Control Plan"
"27",22112714048663,4403576229527,"Information on Ban on Gas Leaf Blowers"
"28",21977977724183,4403568415127,"Fentanyl State of Emergency 2024"
"29",21840940480535,21840903980823,"Template ROW Article"
"30",21635657549335,9940924520727,"Info on Food Truck Pilot Program"
"31",21441478315031,4403576736663,"Info on PBOT Encroachment/Minor Improvement Permitting and Inspections"
"32",21441382249623,4403576736663,"Info on PBOT Public Works Permitting and Inspections"
"33",21441332389911,4403576736663,"Info on PBOT Utility (Street Opening) Permitting and Inspections"
"34",21297463324439,4403576713623,"Info on No Camping, No RV Parking, No Overnight Parking Signage"
"35",21201097046167,7222165929239,"Request Assistance from a City Street Outreach Worker (Portland)"
"36",21173499944599,20831390960919,"Traffic Control Plan (TCP) and Work Space Diagram (WSD) Requirements"
"37",21171976346391,20708256067863,"Reserving Truck Loading Zones in Metered Areas"
"38",21169438157335,20708256067863,"Reserving ""No Parking"" Areas"
"39",21081585553815,10761927324823,"CSZ Paperwork from Community Members"
"40",21022244947479,20708256067863,"Reserving Parking in a Pro-Time Lanes"
"41",20989205574679,20708256067863,"Reserving Hotel Zones"
"42",20982747705623,20831370646423,"Director Park Information"
"43",20930624243863,13087310179223,"Acronyms/Abbreviations Directory"
"44",20896567191447,9812921016983,"Winter Storm 2024 - Emergency Relief for Small Businesses"
"45",20885817032343,4403568447383,"Winter Storm 2024 - Information on Team Rubicon"
"46",20871955985047,4403569040535,"Test Accounts"
"47",20775242384663,20708256067863,"Reserving Carshare Spaces"
"48",20766050086295,20708256067863,"Passenger Vehicle Parameters for Reserved Parking Spaces"
"49",20764720287639,20708256067863,"Reserving Parking with Traffic Control"
"50",20751524232471,11497840017047,"Private Property Tree Emergencies"
"51",20734141933847,20708256067863,"Permitting Angled Parking Spaces or Head-In Parking Spaces"
"52",20711056997655,20708256067863,"Unusual Parking Requests: TSUP Guidelines"
"53",20685309549847,8033413190551,"Report a Maintenance Issue in a Park"
"54",20629011866903,17861271280919,"Oregon Board of Licensed Social Workers"
"55",20122695914135,4403576252695,"Portland Winter Ice Rink"
"56",20064806600855,4403576713623,"Report Human Waste in the Public Right of Way (feces/poop)"
"57",19682544096791,4403576246551,"ADA Contacts - Other Local Jurisdictions"
"58",19653644299415,9940924520727,"CSZ Front Desk Outdoor Dining Intake"
"59",19229114403095,7893301858071,"Info on Federal Bureau of Investigations (FBI)"
"60",19076432558487,13119341296663,"Info on Requesting a Welfare Check"
"61",18514516937239,11497840017047,"Report a Hazardous Tree"
"62",18196587013783,4403576713623,"Addressing Campsite Issues on Private Property"
"63",18179590003735,4403576706967,"CSZ Portland Building Tours"
"64",17865460620695,4403569092503,"Downtown Business Incentive Credit Program - City Revenue Bureau"
"65",17837999727255,9812921016983,"Oregon Business Council / Portland Central City Task Force"
"66",17830658801431,4403569063959,"CSZ Portland Building Job Interviews"
"67",17715353651223,4403576256535,"Info on Propane Tank Recycling"
"68",17570089724439,13087329420567,"CSR Protocol: Using an Alias"
"69",17542806021911,13087310179223,"Other TrackIts"
"70",17448423230487,9940774574487,"CSZ Private for Hire / Regulatory"
"71",17331087944855,9939959898263,"PBOT Door Hangers - Sewer Repair and Curb Ramp Projects"
"72",17219670469911,14450434473879,"Willamette River Water Quality Testing"
"73",17164809970071,4403569078167,"Parks Light Pole Safety Project (2023)"
"74",17126181395991,9939892205335,"CSZ Bike Count Forms"
"75",17124915792151,9940774574487,"Derelict RV Towing Program"
"76",16889589923095,15191293135895,"Tri-County 911 Service Coordination Program (TC911) - Multnomah County Health Department"
"77",16849564327831,4403576706967,"CSZ First Aid and Menstrual Products"
"78",16822362503703,4403569040535,"CSZ Foreign Retirement Pension Benefit Certificate of Life"
"79",16656190718615,9944766892439,"Report a Safety Issue in a Park (Ranger Dispatch)"
"80",16438434604695,9937020154903,"Zendesk Users - City Partners"
"81",16420947568279,4403576689559,"Find City vehicle Info on AssetWorks"
"82",16344898490007,13119341296663,"Non-Emergency AI Phone Menu - Cayce"
"83",16317471205911,4403576706967,"CSZ Adding Portland Building Outlook Meeting Room Calendar Schedules"
"84",16182864243735,14402664939543,"Info on WSDOT (Washington State Department of Transportation)"
"85",16096201570199,8034898844439,"988 Suicide & Crisis Lifeline"
"86",15957862751895,9937020154903,"ZD Agent Workspace"
"87",15871080493335,4403576256535,"Info on Metro's Boat Turn-In Program"
"88",15825313063831,9813091555863,"Info on Blanchet House"
"89",15807936593303,4403569063191,"Info on Portland Memory Garden"
"90",15806996536855,17912272189719,"Info on Oregon State Plan for Aging"
"91",15731351067543,4403576690839,"Info on Summer Burn Ban 2023"
"92",15702181744279,4403568423447,"Info on Multnomah County Ombudsperson / Ombudsman"
"93",15668762618903,9813091555863,"Info on Lift Urban Portland (Lift Up)"
"94",15628589302167,13087310179223,"Teams Shifts - Scheduling App"
"95",15625025126935,13087310179223,"Service Observe / How to Do Service Observing in Avaya"
"96",15624729850647,8034933431191,"Info on Urban Alchemy"
"97",15569978082711,9813091555863,"Innovative Housing, Inc."
"98",15566031011479,4403569093783,"Special Event Liability Insurance (TULIP)"
"99",15485022634519,4403569042199,"CSZ Bicycle (Bike) Helmets"
"100",15460513436951,13087310179223,"Teams Chat Resources"
"101",15430963166231,17539533051031,"Info on Facility Access Program - Expedited Court Access ID Cards"
"102",15318983256215,9944766892439,"Lost and Found - Portland Parks"
"103",15145303105943,4403576706967,"CSZ Contractor & Union Representative Badges"
"104",15136469904535,15136519295383,"Info on City of Hood River"
"105",15116383808279,4403576713623,"Info on Public Camping Restrictions / Time, Place, Manner Ordinance"
"106",14717655829143,14717654883223,"Info on City of Monmouth"
"107",14685524047639,14449746246039,"Capital Improvement Project Management Office - BES"
"108",14665647373335,13087310179223,"Establish Proof of Address/Residence"
"109",14452518310039,6018702538391,"Report Abuse/Suspected Abuse of an Adult"
"110",14402706951063,14402664939543,"Info on Washington State Police (WSP)"
"111",14402509904535,14401011514519,"Info on City of St. Helens"
"112",14401951019543,14401531449879,"Info on Douglas County (General)"
"113",14401542396567,14401011514519,"Info on Columbia County (General)"
"114",14400597745431,14400464733335,"Info on Deschutes County (General)"
"115",14394899024023,14046952561943,"Info on Marion County (General)"
"116",14393628208279,10127087627415,"How to Change or Update PortlandOregon.gov Passwords/Reset Accounts/Personal Contact Information"
"117",14376051608599,17864424950295,"Info on Talking Book and Braille Library"
"118",14372004987415,12330121507351,"Info on Clark County, WA (General)"
"119",14370014859159,6451981368471,"Info on Washington County (General)"
"120",14365191367191,14365146598039,"Info on City of Grants Pass"
"121",14363136489751,6451981368471,"Info on City of North Plains"
"122",14362836550807,10639182199191,"Info on Corbett, Oregon"
"123",14362554166807,6451981368471,"Info on City of Gaston"
"124",14150039469207,14401011514519,"Info on City of Scappoose"
"125",14149206089111,7892889904791,"Info on City of Dundee"
"126",14148533061271,14046952561943,"Info on City of Keizer"
"127",14147812366615,6451981368471,"Info on King City"
"128",14147607618071,7892889904791,"Info on City of Yamhill"
"129",14146050369559,6451981368471,"Info on City of Durham"
"130",14126090337559,7892889904791,"Info on City of Newberg"
"131",14125975031319,10639182199191,"Info on City of Maywood Park"
"132",14118018108567,11578470586775,"Information on Police and Fire Patches, Coins and Other Collectibles"
"133",14080109482007,4403569040535,"CSZ Front Desk Training"
"134",14075343091607,6451981368471,"Info on City of Cornelius"
"135",14075297397271,6452416002583,"Info on City of Milwaukie"
"136",14074921942167,7892933084695,"Info on City of Wilsonville"
"137",14074286280983,6451981368471,"Info on City of Sherwood"
"138",14073630647191,6452416002583,"Info on City of Lake Oswego"
"139",14073603485207,6451981368471,"Info on City of Banks"
"140",14072369017239,6452416002583,"Info on City of Estacada"
"141",14072057412631,6451981368471,"Info on City of Forest Grove"
"142",14049103136407,14046952561943,"Info on City of Salem"
"143",14048946435351,6452416002583,"Info on City of Boring"
"144",14046452174615,6452416002583,"Info on City of Oregon City"
"145",14044456964759,6451981368471,"Info on City of Hillsboro"
"146",14044014399383,6452416002583,"Info on City of Gladstone"
"147",14008907638679,14008951154071,"Info on City of Eugene"
"148",13980325007511,6451981368471,"Info on City of Beaverton"
"149",13980067157783,11631132595223,"Info on Baker County"
"150",13976165524119,6452416002583,"Info on the City of Canby"
"151",13972523518487,10761927324823,"CSZ Public Computer Terminals"
"152",13970562183063,10761927324823,"CSZ Front Desk Printer"
"153",13860539241879,17539551770135,"County Sheriff/Local Law Enforcement Impersonating Scam Calls"
"154",13793407002519,6452416002583,"Info on City of West Linn"
"155",13793086855703,6452416002583,"Info on City of Happy Valley"
"156",13792717537303,12760555168023,"Portland Police Training Division"
"157",13792448154007,6451981368471,"Info on City of Tualatin"
"158",13792138027543,6451981368471,"Info on City of Tigard"
"159",13790410293655,13790375317911,"Info on City of Wood Village "
"160",13789812146711,6452416002583,"Info on City of Sandy"
"161",13788781726103,13788769389335,"Info on City of Troutdale"
"162",13762108420375,6609414555287,"Info on Gresham Capital Projects (Urban Renewal)"
"163",13745520676631,12727789632151,"Info on PPB Specialized Resources Division"
"164",13744195067031,4403569092503,"List of Tax Prep Resources"
"165",13742899715223,13087310179223,"311 ZD Article Labels"
"166",13662710891543,9941141037847,"Mailers and Certified Mail from PBOT"
"167",13496444863511,13087310179223,"Info on AirTags"
"168",13439273044375,9838228854551,"Info on Bridges"
"169",13432925421463,17864456385943,"Cleanups along the Willamette River"
"170",13299458370327,4403576706967,"Info on CSZ Portland Building Monograph Booklet"
"171",13291066881303,13087310179223,"Zendesk Keyboard Shortcuts"
"172",13268344586519,4403576225815,"BOEC Non-E Call Types (Just for Kelsey - Keep as DRAFT)"
"173",13266293895447,17971729714839,"Request Records on a Person Who Molested My Child"
"174",13247527973399,10638365607959,"Liquor Licenses - Apply, Renew, Temporary (Special Event)"
"175",13177122345495,13087310179223,"Mandatory Reporting FAQs (City Staff)"
"176",13113942343959,4403576704151,"Info on Community Connect - Portland Fire"
"177",13087306320279,13087329420567,"CSR Protocol: Offensive, Abusive, Hate Speech "
"178",13062810572439,9378427503639,"Info on Oregon Walks"
"179",12896355262359,9813091555863,"Willamette Riverkeeper"
"180",12895415348631,9813091555863,"Human Access Project (Willamette River)"
"181",12818353670679,4403576734103,"Winter Storm Emergency - Info on Towed Vehicles"
"182",12785292079127,4403569042199,"Ride Every Wednesday - PBOT Active Transportation"
"183",12668941912471,6609414555287,"Info on Gresham Small Business Assistance"
"184",12590901318167,9944868636951,"What is This Charge from the City on my Credit Card?"
"185",12470236942487,15489224271639,"Info on Multnomah County Library"
"186",12469756283287,4403576225815,"Info on Rapid Entry Lock Boxes for PF&R to Enter in Emergencies"
"187",12445304208663,4403568450711,"Info on Metro Penalty Waivers (Supportive Housing Services)"
"188",12443606577687,6018702538391,"Info on Kitchen Share Southeast"
"189",12442448028439,12330121507351,"Report a Crime - City of Vancouver"
"190",12418572582295,4403569090455,"Connect Another Law Enforcement Agency with Portland Police (PPB)/BOEC"
"191",12418052040983,13119341296663,"Report a Missing Person, Endangered Person, or a Minor"
"192",12412957830935,8034933431191,"Info on All Good Northwest (NW)"
"193",12393440701591,12393439595031,"Info on Multnomah County (General)"
"194",12331060879767,12330121507351,"Info on Clark County 311 Program"
"195",12324753311511,7222165929239,"Info on Temporary Alternative Shelter Sites (TASS)/ Shelter Services"
"196",12248392626071,6018702538391,"Report Child Abuse/Suspected Child Abuse (Hotline)"
"197",12241588077335,4403569058455,"Empowered Neighborhoods Program and Excess to Access Program"
"198",12156514945559,12157031476247,"Submit Public Comment to the Police Accountability Commission"
"199",12127113360791,4403569090455,"Guide for Filing a Police Report - Portland"
"200",12099174439831,12760555168023,"Info on PPB Public Safety Specialists (PS3s)"
"201",12078088495639,10639182199191,"Info on Portland, Maine 311 Program"
"202",12048012780311,4403568439703,"City of Portland and Laborers' Local 483 Strike / Contract Negotiations 2023"
"203",12047427863959,8034959890199,"Info on Portland Winter Light Festival"
"204",11791198859543,4403569048343,"Info on LED Stop Sign Pilot Program"
"205",11736869078935,4403576734103,"What's Happening on My Street?"
"206",11734245605527,11734216795159,"Info on City of Fairview"
"207",11632425223575,11631132595223,"Info on Baker City"
"208",11625573661207,9812922295831,"Info on NW Natural Bill Discount Program"
"209",11525133242647,17912272189719,"Info on In-Home Care Worker / Caregiver Program"
"210",11524033420055,8034717097495,"DoveLewis Emergency Animal Hospital"
"211",11440159335447,9813091555863,"Venture Portland "
"212",11413355251607,5549583819927,"City Commissioner Bureau Assignments 2023"
"213",11337798016407,4403569040919,"List of City Accounting Bureau Contacts"
"214",11335649560471,4403576734103,"Info on PBOT Local Road Winter Weather Updates"
"215",11315501318807,5772532606743,"File a Noise Complaint - Beaverton"
"216",11313202939415,4403576685207,"List of Free Multnomah County Library Resources"
"217",11258691485079,8034898844439,"Info on Trillium Community Health Plan"
"218",11255891459223,17911308380567,"Oregon Physician Orders of Life-Sustaining Treatment (POLST) Program"
"219",11254684596247,10790557620759,"Portland Engagement Project (PEP) – Office of Community & Civic Life"
"220",11251970541207,10638365607959,"Info on Noise Office Jurisdiction/Authority"
"221",11076759982615,4403576225815,"Info on Still Alarms/Request for Assistance for Fire Bureau"
"222",11072538685975,4403569058455,"Info on Small Business Empowerment Program - BDS"
"223",10964562923671,10127100999575,"(Trash Wizard) Online Form for Community Members to Report Trash-Related Issues"
"224",10960979404055,9934296161943,"Info on Avraham's Closet"
"225",10959706048407,6018702538391,"Info on 503-988-5090"
"226",10956355102103,8034898844439,"Info on Mobile Dental Program - Medical Teams International"
"227",10937128566807,13087310179223,"Public Event Permitting Guide"
"228",10909140913047,4403576232215,"Commissioner Rene Gonzalez"
"229",10847947195031,10762297747863,"Info on City Occupational Health and Wellness"
"230",10797793154455,4403576740887,"Request an Extra Capacity Garbage Container"
"231",10795360881303,8034717097495,"Info on Portland Urban Coyote Project"
"232",10738536205207,4403569105815,"CSZ Citywide Deposit Procedure"
"233",10737040368279,9944868636951,"CSZ Parks Key Distribution and Return"
"234",10734596785815,4403576706967,"Info on City Hall/Portland Building Event Scheduling/Room Reservations"
"235",10728817419543,4403576706967,"Info on City Fair Wage Policies"
"236",10726712047639,4403576736663,"Apply for a Temporary Street Use Permit"
"237",10661450487063,4403576720663,"CSZ Area Parking Permit Program Intake"
"238",10658119895831,10761782124055,"CSZ Portland Building Front Desk Security"
"239",10644749103767,13087310179223,"Routes to 311"
"240",10637480333591,12330121507351,"Info on City of Vancouver"
"241",10633434369815,4403576734103,"Info on Bike Infrastructure Maintenance"
"242",10632568235159,4403568414615,"Info on Rental Assistance"
"243",10583934501271,15172135077399,"Verify Marriage Records/Dates"
"244",10583091853463,4403576685207,"Verify Divorce Information"
"245",10545624721559,14449886770839,"Info on BES Treebate Program"
"246",10451947107607,17910193131671,"Info on Flu Hotline"
"247",10451878693527,9378427503639,"Info on The Street Trust"
"248",10451740333463,8034898844439,"Info on Northwest Health Foundation (NWHF)"
"249",10448754129175,6018702538391,"Info on Adopt One Block"
"250",10447776376855,4403569058455,"Schedule a 15-minute Appointment with BDS"
"251",10383398602775,15489454610071,"Info on Multnomah County Garbage, Recycling, and Composting Curbside Services"
"252",10325605198743,11496113174039,"Info on Fix-It-Fairs"
"253",10305542134039,4403576229527,"Info on Multifamily Utility Assistance Programs"
"254",10270640406167,4403569090455,"Look up a Case Number (Public Records)"
"255",10256924283031,4662992412183,"Opsman (Operator Management) for Pay-by-Plate"
"256",10199264882199,9937020154903,"Glossary of Common Zendesk Terms"
"257",10144547824407,17539540007959,"File a Police Report - Multnomah County Sheriff"
"258",10119958568855,10119858193175,"Info on City of Portland Transition Plan"
"259",10073569101463,4403576707991,"Info on Police Child Abuse Team (CAT)"
"260",10072963435927,7893301858071,"Info on Environmental Protection Agency’s (EPA) Lead Information Center"
"261",10013660985623,17882488224151,"Info on Oregon Office of Emergency Management"
"262",10013502551959,7893301858071,"Info on FEMA (Federal Emergency Management Agency)"
"263",10012967325335,4403568447383,"Info on RAPTOR (Real-time Assessment and Planning Tool for Oregon)"
"264",10012516388759,4403568447383,"Info on Regional Disaster Preparedness Organization (RDPO)"
"265",9986787456407,4403576740887,"Info on Business Food Scraps Requirement"
"266",9915533199255,9915532199319,"How to Feed Kelsey's Dog (Example)"
"267",9911523165847,4403569061015,"Schedule a 15-minute appointment with PBOT"
"268",9840268516887,5549583819927,"Contact an Elected Official"
"269",9760177728919,11577284914711,"Info on Neighborhood Prosperity Initiative"
"270",9757996102167,9812922295831,"Report a Blocked Railroad Crossing"
"271",9757413729431,9812922295831,"Info on Trains/Railroad Crossing Blockage Issues"
"272",9706923477655,14449969094167,"Info on Poop to Power Project"
"273",9606828335895,4403576730135,"Info on Southeast Portland Tool Library (SEPTL)"
"274",9604885323543,4403569094551,"Apply for a Community Event Permit - PBOT"
"275",9553530038167,4403569096087,"Apply for Streetlight Event Banner Permit"
"276",9532568774935,11578014724503,"Info on Down Payment Assistance Loan Program (PHB)"
"277",9512484772631,4403568417943,"Info on Portland Insights Survey"
"278",9506974385047,17967747422999,"Info on Multnomah County Restitution Collections"
"279",9351836111895,4403576712087,"View City Staff/Employee Directory"
"280",9304060036759,11577306491415,"Info on Prosper Portland's PropertyFit Program"
"281",9303513985815,4403569068183,"Info on Energy Trust of Oregon"
"282",9232210384791,4403576740887,"Look up Garbage Hauler Information - Homeowners"
"283",9226322573463,6609414555287,"Info on City of Gresham (General)"
"284",9224693425431,9838622828823,"CLOSED -  Neighborhood Access Sites"
"285",9224582551319,9838622828823,"CLOSED - Association of Community Organizations for Reform Now"
"286",9224476040471,9838622828823,"CLOSED - Better People Program"
"287",9224416018967,9838622828823,"CLOSED - City Hall Oregonian Office"
"288",9224117015447,9838622828823,"CLOSED - Fork It Over Program"
"289",9224006126871,9838622828823,"CLOSED - Fulton Park Community Center"
"290",9223384359831,9838622828823,"Hillside Community Center"
"291",9223221141399,9838622828823,"CLOSED - North Portland Field Team"
"292",9223136229783,9838622828823,"CLOSED - Oregon Welcome Center"
"293",9222760778007,9838622828823,"CLOSED - Unwire Program"
"294",9222557674519,9838622828823,"CLOSED - Youth Employment Institute"
"295",9222433678231,9838622828823,"CLOSED - Tri-County Farm Fresh Produce Guide (Still Online)"
"296",9221906720663,9221115762199,"Request a Safe Blocks Training, Security Assessment, or Help with Community Building Ideas"
"297",9203972218647,8034934627351,"Info on Community Alliance of Tenants (CAT)"
"298",9203750912791,9378427503639,"Info on Community Cycling Center"
"299",9200204765847,9813146405911,"Info on Confederated Tribes of Siletz Indians"
"300",9199887458583,9837630407831,"List of Consulate Contacts"
"301",9199404990743,17971729714839,"Info on Court Reporters"
"302",9199201510551,9813030927127,"Info on Credit Counseling"
"303",9198474324631,9813030927127,"Info on Credit Reporting Agencies"
"304",9177591904919,17882560189463,"Info on Department of Public Safety Standards and Training"
"305",9177237296919,8034933431191,"Info on Dignity Village Inc."
"306",9177115475607,9812921016983,"Info on Dislocated Workers Program (DWP)"
"307",9176997954071,17888145264023,"Financial Institution Complaints - Info on Division of Financial Regulation"
"308",9176418842903,9812921016983,"Info on East Portland Chamber of Commerce"
"309",9176241184791,9813091555863,"Info on El Programa Hispano"
"310",9175296133783,8034959890199,"Info on First Thursday Gallery Exhibitions"
"311",9170612197655,9817372204055,"Info on Friends of the Library (FOL)"
"312",9170355191575,9837856083223,"Info on Girls Inc."
"313",9170096249111,9378710071447,"Info on Habitat for Humanity (Portland/Metro East)"
"314",9169610682775,8034717097495,"Info on Portland Animal Welfare Team (PAW)"
"315",9151244574359,9812921016983,"Info on Hispanic Metropolitan Chamber (HMCC)"
"316",9151144488215,8034959890199,"List of Portland Holiday Events"
"317",9150238532503,4403569111831,"Info on Japanese Garden"
"318",9149097754775,17888098409111,"Info on Landscape Contractor's Board (LCB)"
"319",9148847678871,9837542049559,"Info on Linnton Community Center"
"320",9148454884503,9817372204055,"List of Local Colleges"
"321",9148205569687,8034898844439,"List of Low Cost Eye Clinics "
"322",9148071292567,17891737398551,"Info on Manufactured Communities Resource Center"
"323",9147366233879,8034898844439,"Info on Medical Society of Metropolitan Portland (MSMP)"
"324",9147063532951,8034260023703,"Apply for a Metro Contractor's Business License (Excludes Portland)"
"325",9146656995991,6609414555287,"Info on MetroEast Community Media"
"326",9146542443799,9837856083223,"Info on Metropolitan Family Services (Ways to Work and Parenting Programs)"
"327",9146376830871,8034898844439,"Info on Morrison Child and Family Services"
"328",9146163548567,9838523960599,"Info on Multnomah County Drainage District"
"329",9145578449943,9813091555863,"Info on National Association for Advancement of Colored People (NAACP)"
"330",9145329937431,9813091555863,"Info on Native American Rehabilitation Association of the Northwest, Inc (NARA)"
"331",9144918067095,9813091555863,"Info on NAYA (Native American Youth Association)"
"332",9144506673687,8034933431191,"Info on New Avenues for Youth"
"333",9143311908759,17865913288343,"Info on Occupational Safety and Health  (OSHA)"
"334",9143092277655,9838622828823,"CLOSED - Office of Healthy Working Rivers"
"335",9142946084631,8034898844439,"Info on Oregon AIDS/STD Hotline"
"336",9142566728599,9812921016983,"Info on Oregon Association of Minority Entrepreneurs (OAME)"
"337",9096292242583,8034959890199,"Info on Oregon Children's Theatre"
"338",9093967862167,9813091555863,"Info on Oregon Human Development Corporation (OHDC)"
"339",9093710598679,9378427503639,"Info on Oregon Impact (Car Seat, Helmet, Scooter Laws)"
"340",9093233110551,8034959890199,"Info on Oregon Maritime Museum"
"341",9093030160535,9812921016983,"Info on Oregon Native American Business Network (ONABEN)"
"342",9092800015255,17888243399831,"Info on Oregon State Board of Nursing (OSBN)"
